{
    "cycloneMessage": {
        "atcfID": "AL012017",
        "issuingUnit": "NWS NATIONAL HURRICANE CENTER MIAMI FL",
        "messageType": "ROUTINE ADVISORY",
        "messageBinNumber": "1",
        "advisoryNumber": "9",
        "messageDateTimeLocal": "20170421 11:00:00 AM AST",
        "messageDateTimeUTC": "20170421 03:00:00 PM UTC",
        "messageDateTimeUTC24": "201704211500",
        "messageDateTimeLocalStr": "1100 AM AST Fri Apr 21",
        "timeEpochSeconds": "1492786800",
        "systemType": "POST-TROPICAL CYCLONE",
        "systemName": "ARLENE",
        "centerLocLatitude": "39.3",
        "centerLocLongitude": "-49.9",
        "centerLocLatitudeExpanded": "39.3N",
        "centerLocLongitudeExpanded": "49.9W",
        "systemIntensityMph": "50",
        "systemIntensityKph": "85",
        "systemIntensityKts": "45",
        "systemMslpMb": "995",
        "systemMslpInHg": "29.39",
        "systemSaffirSimpsonCategory": "N/A",
        "formationChancePct48h": "N/A",
        "formationChancePct5d": "N/A",
        "systemDirectionOfMotion": "SW OR 220 DEGREES",
        "systemSpeedMph": "23",
        "systemSpeedKph": "37",
        "systemSpeedKts": "20",
        "systemGeoRefPt1": "ABOUT 1235 MI...1985 KM W OF THE AZORES",
        "message": "ZCZC MIATCPAT1 ALL\nTTAA00 KNHC DDHHMM\n\nBULLETIN\nPost-Tropical Cyclone Arlene Advisory Number   9\nNWS National Hurricane Center Miami FL       AL012017\n1100 AM AST Fri Apr 21 2017\n\n...ARLENE MERGES WITH A LARGE EXTRATROPICAL CYCLONE...\n...THIS IS THE LAST ADVISORY...\n\n\nSUMMARY OF 1100 AM AST...1500 UTC...INFORMATION\n-----------------------------------------------\nLOCATION...39.3N 49.9W\nABOUT 1235 MI...1985 KM W OF THE AZORES\nMAXIMUM SUSTAINED WINDS...50 MPH...85 KM/H\nPRESENT MOVEMENT...SW OR 220 DEGREES AT 23 MPH...37 KM/H\nMINIMUM CENTRAL PRESSURE...995 MB...29.39 INCHES\n\n\nWATCHES AND WARNINGS\n--------------------\nThere are no coastal watches or warnings in effect.\n\n\nDISCUSSION AND 48-HOUR OUTLOOK\n------------------------------\nAt 1100 AM AST (1500 UTC), the center of Post-Tropical Cyclone\nArlene was located near latitude 39.3 North, longitude 49.9 West.\nThe post-tropical cyclone is moving toward the southwest near 23 mph\n(37 km/h), and this general motion is expected to continue until\ndissipation.\n\nMaximum sustained winds are near 50 mph (85 km/h) with higher gusts.\nThe post-tropical cyclone is forecast to dissipate later\ntoday.\n\nTropical-storm-force winds extend outward up to 230 miles (370 km)\nfrom the center.\n\nThe estimated minimum central pressure is 995 mb (29.39 inches).\n\n\nHAZARDS AFFECTING LAND\n----------------------\nNone.\n\n\nNEXT ADVISORY\n-------------\nThis is the last public advisory issued by the National Hurricane\nCenter on this system. Additional information on this system can be\nfound in High Seas Forecasts issued by the National Weather Service,\nunder AWIPS header NFDHSFAT1, WMO header FZNT01 KWBC, and available\non the Web at http://www.opc.ncep.noaa.gov/shtml/NFDHSFAT1.shtml.\n\n$$\nForecaster Avila\n\nNNNN"
    }
}