{
  "cycloneMessage": {
    "advisoryNumber": "7",
    "atcfID": "AL042017",
    "centerLocLatitude": "15.6",
    "centerLocLatitudeExpanded": "15.6N",
    "centerLocLongitude": "-50.9",
    "centerLocLongitudeExpanded": "50.9W",
    "formationChancePct48h": "N/A",
    "formationChancePct5d": "N/A",
    "issuingUnit": "NWS NATIONAL HURRICANE CENTER MIAMI FL",
    "message": "ZCZC MIATCPAT4 ALL\nTTAA00 KNHC DDHHMM\n\nBULLETIN\nTropical Depression Four Advisory Number   7\nNWS National Hurricane Center Miami FL       AL042017\n1100 AM AST Fri Jul 07 2017\n\n...DEPRESSION FORECAST TO DEGENERATE INTO A LOW PRESSURE SYSTEM\nLATER TODAY...\n\n\nSUMMARY OF 1100 AM AST...1500 UTC...INFORMATION\n-----------------------------------------------\nLOCATION...15.6N 50.9W\nABOUT 690 MI...1115 KM E OF THE LESSER ANTILLES\nMAXIMUM SUSTAINED WINDS...30 MPH...45 KM/H\nPRESENT MOVEMENT...WNW OR 290 DEGREES AT 21 MPH...33 KM/H\nMINIMUM CENTRAL PRESSURE...1011 MB...29.86 INCHES\n\n\nWATCHES AND WARNINGS\n--------------------\nThere are no coastal watches or warnings in effect.\n\n\nDISCUSSION AND 48-HOUR OUTLOOK\n------------------------------\nAt 1100 AM AST (1500 UTC), the center of Tropical Depression Four\nwas located near latitude 15.6 North, longitude 50.9 West. The\ndepression is moving toward the west-northwest near 21 mph (33\nkm/h), and this motion is expected to continue today.\n\nMaximum sustained winds are near 30 mph (45 km/h) with higher\ngusts, and these winds are probably associated with a few remaining\nsqualls. The depression is forecast to degenerate into a remnant\nlow tonight.\n\nThe estimated minimum central pressure is 1011 mb (29.86 inches).\n\n\nHAZARDS AFFECTING LAND\n----------------------\nNone.\n\n\nNEXT ADVISORY\n-------------\nNext complete advisory at 500 PM AST.\n\n$$\nForecaster Avila\n\nNNNN",
    "messageBinNumber": "4",
    "messageDateTimeLocal": "20170707 11:00:00 AM AST",
    "messageDateTimeLocalStr": "1100 AM AST Fri Jul 07",
    "messageDateTimeUTC": "20170707 03:00:00 PM UTC",
    "messageDateTimeUTC24": "201707071500",
    "messageType": "ROUTINE ADVISORY",
    "systemDirectionOfMotion": "WNW OR 290 DEGREES",
    "systemGeoRefPt1": "ABOUT 690 MI...1115 KM E OF THE LESSER ANTILLES",
    "systemIntensityKph": "45",
    "systemIntensityKts": "25",
    "systemIntensityMph": "30",
    "systemMslpInHg": "29.86",
    "systemMslpMb": "1011",
    "systemName": "FOUR",
    "systemSaffirSimpsonCategory": "N/A",
    "systemSpeedKph": "33",
    "systemSpeedKts": "18",
    "systemSpeedMph": "21",
    "systemType": "TROPICAL DEPRESSION",
    "timeEpochSeconds": "1499439600"
  }
}
