{
  "cycloneMessage": {
    "advisoryNumber": "5A",
    "atcfID": "AL052017",
    "centerLocLatitude": "11.9",
    "centerLocLatitudeExpanded": "11.9N",
    "centerLocLongitude": "-61.4",
    "centerLocLongitudeExpanded": "61.4W",
    "formationChancePct48h": "N/A",
    "formationChancePct5d": "N/A",
    "issuingUnit": "NWS NATIONAL HURRICANE CENTER MIAMI FL",
    "message": "ZCZC MIATCPAT5 ALL\nTTAA00 KNHC DDHHMM\n\nBULLETIN\nTropical Storm Don Intermediate Advisory Number 5A\nNWS National Hurricane Center Miami FL       AL052017\n800 PM AST Tue Jul 18 2017\n\n...DON ACCELERATING WESTWARD AS IT APPROACHES GRENADA...\n\n\nSUMMARY OF 800 PM AST...0000 UTC...INFORMATION\n----------------------------------------------\nLOCATION...11.9N 61.4W\nABOUT 25 MI...40 KM SE OF GRENADA\nABOUT 100 MI...155 KM S OF ST. VINCENT\nMAXIMUM SUSTAINED WINDS...40 MPH...65 KM/H\nPRESENT MOVEMENT...W OR 275 DEGREES AT 23 MPH...37 KM/H\nMINIMUM CENTRAL PRESSURE...1011 MB...29.85 INCHES\n\n\nWATCHES AND WARNINGS\n--------------------\nCHANGES WITH THIS ADVISORY:\n\nThe government of the Netherlands has discontinued the Tropical\nStorm Watch for Bonaire.\n\nSUMMARY OF WATCHES AND WARNINGS IN EFFECT:\n\nA Tropical Storm Warning is in effect for...\n* Grenada\n* St. Vincent and the Grenadines\n\nInterests in Trinidad and Tobago, Bonaire, Curacao, and Aruba should\ncontinue to monitor the progress of Don.\n\nFor storm information specific to your area, please monitor\nproducts issued by your national meteorological service.\n\n\nDISCUSSION AND 48-HOUR OUTLOOK\n------------------------------\nAt 800 PM AST (0000 UTC), the center of Tropical Storm Don was\nlocated near latitude 11.9 North, longitude 61.4 West.  Don is\nmoving toward the west near 23 mph (37 km/h).  This general motion\nis expected through Wednesday.  On the forecast track, the center of\nDon will move across the Windward Islands within the next few hours,\nand then move westward across the southeastern Caribbean Sea late\ntonight and Wednesday.\n\nMaximum sustained winds are near 40 mph (65 km/h) with higher\ngusts.  Little change in strength is forecast during the next 24\nhours.  The system is forecast to degenerate into a trough of low\npressure tonight or Wednesday.\n\nTropical-storm-force winds extend outward up to 35 miles (55 km)\nfrom the center.\n\nThe estimated minimum central pressure is 1011 mb (29.85 inches).\n\n\nHAZARDS AFFECTING LAND\n----------------------\nWIND:  Tropical storm conditions are expected to spread across the\nWindward Islands within the warning area during the next several\nhours.\n\nRAINFALL:  Don is expected to produce total rain accumulations of\n3 to 6 inches, with isolated higher amounts, across Trinidad and\nTobago and the southern Windward Islands through Wednesday.  These\nrains could produce life-threatening flash floods and mudslides,\nespecially in mountainous areas.\n\n\nNEXT ADVISORY\n-------------\nNext complete advisory at 1100 PM AST.\n\n$$\nForecaster Berg\n\nNNNN",
    "messageBinNumber": "5",
    "messageDateTimeLocal": "20170718 08:00:00 PM AST",
    "messageDateTimeLocalStr": "0800 PM AST Tue Jul 18",
    "messageDateTimeUTC": "20170719 12:00:00 AM UTC",
    "messageDateTimeUTC24": "201707190000",
    "messageType": "INTERMEDIATE ADVISORY",
    "systemDirectionOfMotion": "W OR 275 DEGREES",
    "systemGeoRefPt1": "ABOUT 25 MI...40 KM SE OF GRENADA",
    "systemGeoRefPt2": "ABOUT 100 MI...155 KM S OF ST. VINCENT",
    "systemIntensityKph": "65",
    "systemIntensityKts": "35",
    "systemIntensityMph": "40",
    "systemMslpInHg": "29.85",
    "systemMslpMb": "1011",
    "systemName": "DON",
    "systemSaffirSimpsonCategory": "N/A",
    "systemSpeedKph": "37",
    "systemSpeedKts": "20",
    "systemSpeedMph": "23",
    "systemType": "TROPICAL STORM",
    "timeEpochSeconds": "1500422400"
  }
}
