{
  "cycloneMessage": {
    "advisoryNumber": "3",
    "atcfID": "AL062017",
    "centerLocLatitude": "27.6",
    "centerLocLatitudeExpanded": "27.6N",
    "centerLocLongitude": "-82.8",
    "centerLocLongitudeExpanded": "82.8W",
    "formationChancePct48h": "N/A",
    "formationChancePct5d": "N/A",
    "issuingUnit": "NWS NATIONAL HURRICANE CENTER MIAMI FL",
    "message": "ZCZC MIATCPAT1 ALL\nTTAA00 KNHC DDHHMM\n\nBULLETIN\nTropical Storm Emily Advisory Number   3\nNWS National Hurricane Center Miami FL       AL062017\n1100 AM EDT Mon Jul 31 2017\n\n...EMILY APPROACHING THE MOUTH OF TAMPA BAY...\n...HEAVY RAINFALL EXPECTED OVER THE CENTRAL AND SOUTHERN FLORIDA\nPENINSULA...\n\n\nSUMMARY OF 1100 AM EDT...1500 UTC...INFORMATION\n-----------------------------------------------\nLOCATION...27.6N 82.8W\nABOUT 35 MI...55 KM SW OF TAMPA FLORIDA\nABOUT 30 MI...45 KM NW OF SARASOTA FLORIDA\nMAXIMUM SUSTAINED WINDS...45 MPH...75 KM/H\nPRESENT MOVEMENT...E OR 90 DEGREES AT 9 MPH...15 KM/H\nMINIMUM CENTRAL PRESSURE...1005 MB...29.68 INCHES\n\n\nWATCHES AND WARNINGS\n--------------------\nCHANGES WITH THIS ADVISORY:\n\nNone.\n\nSUMMARY OF WATCHES AND WARNINGS IN EFFECT:\n\nA Tropical Storm Warning is in effect for...\n* Anclote River to Bonita Beach Florida\n\nA Tropical Storm Warning means that tropical storm conditions are\nlikely within the warning area, in this case within the next few\nhours.\n\nFor storm information specific to your area, including possible\ninland watches and warnings, please monitor products issued by your\nlocal National Weather Service forecast office.\n\n\nDISCUSSION AND 48-HOUR OUTLOOK\n------------------------------\nAt 1100 AM EDT (1500 UTC), the center of Tropical Storm Emily was\nlocated near latitude 27.6 North, longitude 82.8 West. Emily is\nmoving toward the east near 9 mph (15 km/h), and this general motion\nis expected to continue today.  A turn toward the northeast with an\nincrease in forward speed are expected by tonight and Tuesday. On\nthe forecast track, the center of Emily is expected to move inland\nover the the west-central Florida peninsula this afternoon, and move\nacross central Florida through tonight.  Emily is forecast to move\noffshore of the east-central Florida coast Tuesday morning.\n\nMaximum sustained winds are near 45 mph (75 km/h) with higher gusts.\nLittle change in strength is forecast until landfall occurs this\nafternoon.  Emily is expected to weaken to a tropical depression\nwhile it moves across the Florida peninsula later today and tonight.\n\nTropical-storm-force winds extend outward up to 60 miles (95 km)\nfrom the center.\n\nThe estimated minimum central pressure is 1005 mb (29.68 inches).\n\n\nHAZARDS AFFECTING LAND\n----------------------\nRAINFALL:  Emily is expected to produce total rain accumulations of\n2 to 4 inches through Monday night along the west coast of central\nFlorida between the Tampa Bay area and Naples, with isolated amounts\nup to 8 inches possible. Elsewhere across central and south Florida,\n1 to 2 inches of rain is expected with localized amounts of up to 4\ninches possible. Reports from amateur radio operators indicate that\nstreet and road flooding has already been occurring in Manatee and\nSarasota Counties near the Myakka River.\n\nWIND:  Tropical storm conditions are likely within the warning area\nthrough this afternoon.\n\nTORNADOES: A brief tornado could occur across the central and\nsouthern Florida Peninsula today, with isolated waterspouts\npossible over the coastal waters of southwestern Florida.\n\n\nNEXT ADVISORY\n-------------\nNext intermediate advisory at 200 PM EDT.\nNext complete advisory at 500 PM EDT.\n\n$$\nForecaster Stewart\n\nNNNN",
    "messageBinNumber": "1",
    "messageDateTimeLocal": "20170731 11:00:00 AM EDT",
    "messageDateTimeLocalStr": "1100 AM EDT Mon Jul 31",
    "messageDateTimeUTC": "20170731 03:00:00 PM UTC",
    "messageDateTimeUTC24": "201707311500",
    "messageType": "ROUTINE ADVISORY",
    "systemDirectionOfMotion": "E OR 90 DEGREES",
    "systemGeoRefPt1": "ABOUT 35 MI...55 KM SW OF TAMPA FLORIDA",
    "systemGeoRefPt2": "ABOUT 30 MI...45 KM NW OF SARASOTA FLORIDA",
    "systemIntensityKph": "75",
    "systemIntensityKts": "40",
    "systemIntensityMph": "45",
    "systemMslpInHg": "29.68",
    "systemMslpMb": "1005",
    "systemName": "EMILY",
    "systemSaffirSimpsonCategory": "N/A",
    "systemSpeedKph": "15",
    "systemSpeedKts": "8",
    "systemSpeedMph": "9",
    "systemType": "TROPICAL STORM",
    "timeEpochSeconds": "1501513200"
  }
}
