{
  "cycloneMessage": {
    "advisoryNumber": "14A",
    "atcfID": "AL072017",
    "centerLocLatitude": "20.0",
    "centerLocLatitudeExpanded": "20.0N",
    "centerLocLongitude": "-96.7",
    "centerLocLongitudeExpanded": "96.7W",
    "formationChancePct48h": "N/A",
    "formationChancePct5d": "N/A",
    "issuingUnit": "NWS NATIONAL HURRICANE CENTER MIAMI FL",
    "message": "ZCZC MIATCPAT2 ALL\nTTAA00 KNHC DDHHMM\n\nBULLETIN\nHurricane Franklin Intermediate Advisory Number 14A\nNWS National Hurricane Center Miami FL       AL072017\n100 AM CDT Thu Aug 10 2017\n\n...FRANKLIN MAKES LANDFALL ON THE COAST OF MEXICO AS A CATEGORY ONE\nHURRICANE...\n\n\nSUMMARY OF 100 AM CDT...0600 UTC...INFORMATION\n----------------------------------------------\nLOCATION...20.0N 96.7W\nABOUT 80 MI...130 KM SE OF TUXPAN MEXICO\nABOUT 70 MI...115 KM NNW OF VERACRUZ MEXICO\nMAXIMUM SUSTAINED WINDS...85 MPH...140 KM/H\nPRESENT MOVEMENT...W OR 260 DEGREES AT 13 MPH...20 KM/H\nMINIMUM CENTRAL PRESSURE...988 MB...29.18 INCHES\n\n\nWATCHES AND WARNINGS\n--------------------\nCHANGES WITH THIS ADVISORY:\n\nNone.\n\nSUMMARY OF WATCHES AND WARNINGS IN EFFECT:\n\nA Hurricane Warning is in effect for...\n* The coast of Mexico from Puerto de Veracruz to Cabo Rojo\n\nA Hurricane Watch is in effect for...\n* The coast of Mexico north of Cabo Rojo to Rio Panuco\n\nA Tropical Storm Warning is in effect for...\n* The coast of Mexico south of Puerto de Veracruz to Puerto Dos\nBocas\n* The coast of Mexico north of Cabo Rojo to Barra del Tordo\n\nA Hurricane Warning means that hurricane conditions are expected\nsomewhere within the warning area.  Preparations to protect life and\nproperty should be rushed to completion.\n\nA Hurricane Watch means that hurricane conditions are possible\nwithin the watch area.\n\nA Tropical Storm Warning means that tropical storm conditions are\nexpected somewhere within the warning area.\n\nFor storm information specific to your area, please monitor\nproducts issued by your national meteorological service.\n\n\nDISCUSSION AND 48-HOUR OUTLOOK\n------------------------------\nAt 100 AM CDT (0600 UTC), the center of Hurricane Franklin was\nlocated near latitude 20.0 North, longitude 96.7 West. Franklin is\nmoving a little south of west near 13 mph (20 km/h), and this\ngeneral motion is expected to continue during the next day or so.\nDuring the past hour, the center of Franklin made landfall in the\nMexican state of Veracruz near the town of Lechuguillas.  The center\nis expected to move farther inland during the next several hours.\n\nReports from an Air Force Reserve Hurricane Hunter aircraft indicate\nthat the maximum sustained winds are near 85 mph (140 km/h) with\nhigher gusts.  Rapid weakening is forecast as the hurricane moves\nfarther inland.\n\nHurricane-force winds extend outward up to 35 miles (55 km) from\nthe center and tropical-storm-force winds extend outward up to 150\nmiles (240 km).\n\nThe minimum central pressure estimated from the Hurricane Hunter\naircraft data is 988 mb (29.18 inches).\n\n\nHAZARDS AFFECTING LAND\n----------------------\nRAINFALL:  Rainfall totals of 4 to 8 inches with isolated maximum\namounts of 15 inches are possible across the Mexican states of\nTabasco, northern Veracruz, northern Puebla, Tlaxacala, Hidalgo,\nQueretar and eastern San Luis Potosi in eastern Mexico.  These rains\nwill be capable of producing life-threatening flash floods and\nmudslides.\n\nWIND:  Hurricane conditions are occurring on the coast within\nthe Hurricane Warning area. Preparations to protect life and\nproperty should be rushed to completion.\n\nTropical storm conditions are expected across portions of the\nTropical Storm Warning area along the southern shore of the Bay of\nCampeche through early Thursday.  Hurricane conditions are possible\nwithin the Hurricane Watch area for the next few hours.\nTropical storm conditions are expected within the Tropical Storm\nWarning area in eastern Mexico during the next several hours.\n\nSTORM SURGE:  A dangerous storm surge will raise water levels by\nas much as 4 to 6 feet above normal tide levels along the\nimmediate coast near and to the north of where the center makes\nlandfall in the Hurricane Warning area.  Near the coast, the\nsurge will be accompanied by large and destructive waves.\n\n\nNEXT ADVISORY\n-------------\nNext complete advisory at 400 AM CDT.\n\n$$\nForecaster Beven\n\nNNNN",
    "messageBinNumber": "2",
    "messageDateTimeLocal": "20170810 01:00:00 AM CDT",
    "messageDateTimeLocalStr": "0100 AM CDT Thu Aug 10",
    "messageDateTimeUTC": "20170810 06:00:00 AM UTC",
    "messageDateTimeUTC24": "201708100600",
    "messageType": "INTERMEDIATE ADVISORY",
    "systemDirectionOfMotion": "W OR 260 DEGREES",
    "systemGeoRefPt1": "ABOUT 80 MI...130 KM SE OF TUXPAN MEXICO",
    "systemGeoRefPt2": "ABOUT 70 MI...115 KM NNW OF VERACRUZ MEXICO",
    "systemIntensityKph": "140",
    "systemIntensityKts": "75",
    "systemIntensityMph": "85",
    "systemMslpInHg": "29.18",
    "systemMslpMb": "988",
    "systemName": "FRANKLIN",
    "systemSaffirSimpsonCategory": "CATEGORY 1",
    "systemSpeedKph": "20",
    "systemSpeedKts": "11",
    "systemSpeedMph": "13",
    "systemType": "HURRICANE",
    "timeEpochSeconds": "1502344800"
  }
}
