{
  "cycloneMessage": {
    "advisoryNumber": "7",
    "atcfID": "AL082017",
    "centerLocLatitude": "30.3",
    "centerLocLatitudeExpanded": "30.3N",
    "centerLocLongitude": "-72.2",
    "centerLocLongitudeExpanded": "72.2W",
    "formationChancePct48h": "N/A",
    "formationChancePct5d": "N/A",
    "issuingUnit": "NWS NATIONAL HURRICANE CENTER MIAMI FL",
    "message": "ZCZC MIATCPAT3 ALL\nTTAA00 KNHC DDHHMM\n\nBULLETIN\nTropical Storm Gert Advisory Number   7\nNWS National Hurricane Center Miami FL       AL082017\n1100 AM EDT Mon Aug 14 2017\n\n...GERT GETS A LITTLE STRONGER...\n...SWELLS EXPECTED TO BEGIN AFFECTING PORTIONS OF THE U.S. EAST\nCOAST LATER TODAY...\n\n\nSUMMARY OF 1100 AM EDT...1500 UTC...INFORMATION\n-----------------------------------------------\nLOCATION...30.3N 72.2W\nABOUT 460 MI...735 KM WSW OF BERMUDA\nMAXIMUM SUSTAINED WINDS...60 MPH...95 KM/H\nPRESENT MOVEMENT...N OR 360 DEGREES AT 8 MPH...13 KM/H\nMINIMUM CENTRAL PRESSURE...1002 MB...29.59 INCHES\n\n\nWATCHES AND WARNINGS\n--------------------\nThere are no coastal watches or warnings in effect.\n\n\nDISCUSSION AND 48-HOUR OUTLOOK\n------------------------------\nAt 1100 AM EDT (1500 UTC), the center of Tropical Storm Gert was\nlocated near latitude 30.3 North, longitude 72.2 West. Gert is\nmoving toward the north near 8 mph (13 km/h).  A gradual turn toward\nthe northeast with an increase in forward speed is forecast for the\nnext 48 h.\n\nMaximum sustained winds have increased to near 60 mph (95 km/h)\nwith higher gusts.  Additional strengthening is forecast and Gert\nis expected to become a hurricane by tomorrow night.\n\nTropical-storm-force winds extend outward up to 90 miles (150 km)\nfrom the center.\n\nThe estimated minimum central pressure is 1002 mb (29.59 inches).\n\n\nHAZARDS AFFECTING LAND\n----------------------\nSURF:  Swells generated by Gert will begin to affect portions\nof the coast of North Carolina and Virginia later today.  These\nswells are likely to cause life-threatening surf and rip current\nconditions.  Please consult products from your local weather office.\n\n\nNEXT ADVISORY\n-------------\nNext complete advisory at 500 PM EDT.\n\n$$\nForecaster Zelinsky\n\nNNNN",
    "messageBinNumber": "3",
    "messageDateTimeLocal": "20170814 11:00:00 AM EDT",
    "messageDateTimeLocalStr": "1100 AM EDT Mon Aug 14",
    "messageDateTimeUTC": "20170814 03:00:00 PM UTC",
    "messageDateTimeUTC24": "201708141500",
    "messageType": "ROUTINE ADVISORY",
    "systemDirectionOfMotion": "N OR 360 DEGREES",
    "systemGeoRefPt1": "ABOUT 460 MI...735 KM WSW OF BERMUDA",
    "systemIntensityKph": "95",
    "systemIntensityKts": "50",
    "systemIntensityMph": "60",
    "systemMslpInHg": "29.59",
    "systemMslpMb": "1002",
    "systemName": "GERT",
    "systemSaffirSimpsonCategory": "N/A",
    "systemSpeedKph": "13",
    "systemSpeedKts": "7",
    "systemSpeedMph": "8",
    "systemType": "TROPICAL STORM",
    "timeEpochSeconds": "1502722800"
  }
}
