{
  "cycloneMessage": {
    "advisoryNumber": "15",
    "atcfID": "AL112017",
    "centerLocLatitude": "18.3",
    "centerLocLatitudeExpanded": "18.3N",
    "centerLocLongitude": "-46.2",
    "centerLocLongitudeExpanded": "46.2W",
    "formationChancePct48h": "N/A",
    "formationChancePct5d": "N/A",
    "issuingUnit": "NWS NATIONAL HURRICANE CENTER MIAMI FL",
    "message": "ZCZC MIATCPAT1 ALL\nTTAA00 KNHC DDHHMM\n\nBULLETIN\nHurricane Irma Advisory Number  15\nNWS National Hurricane Center Miami FL       AL112017\n1100 PM AST Sat Sep 02 2017\n\n...HURRICANE IRMA HEADING WESTWARD WITH 110 MPH WINDS...\n\n\nSUMMARY OF 1100 PM AST...0300 UTC...INFORMATION\n-----------------------------------------------\nLOCATION...18.3N 46.2W\nABOUT 1030 MI...1655 KM E OF THE LEEWARD ISLANDS\nMAXIMUM SUSTAINED WINDS...110 MPH...175 KM/H\nPRESENT MOVEMENT...W OR 260 DEGREES AT 14 MPH...22 KM/H\nMINIMUM CENTRAL PRESSURE...973 MB...28.74 INCHES\n\n\nWATCHES AND WARNINGS\n--------------------\nThere are no coastal watches or warnings in effect.\n\nInterests in the northern Leeward Islands should monitor the\nprogress of Irma.\n\n\nDISCUSSION AND 48-HOUR OUTLOOK\n------------------------------\nAt 1100 PM AST (0300 UTC), the eye of Hurricane Irma was located\nnear latitude 18.3 North, longitude 46.2 West. Irma is moving toward\nthe west near 14 mph (22 km/h), and a motion just south of due\nwest is expected for the next 48 h.\n\nMaximum sustained winds remain near 110 mph (175 km/h) with\nhigher gusts.  Some strengthening is forecast during the next 48\nhours.\n\nIrma is currently a small-size hurricane. Hurricane-force winds\nextend outward up to 25 miles (35 km) from the center and\ntropical-storm-force winds extend outward up to 70 miles (110 km).\n\nThe estimated minimum central pressure is 973 mb (28.74 inches).\n\n\nHAZARDS AFFECTING LAND\n----------------------\nNone\n\n\nNEXT ADVISORY\n-------------\nNext complete advisory at 500 AM AST.\n\n$$\nForecaster Avila\n\nNNNN",
    "messageBinNumber": "1",
    "messageDateTimeLocal": "20170902 11:00:00 PM AST",
    "messageDateTimeLocalStr": "1100 PM AST Sat Sep 02",
    "messageDateTimeUTC": "20170903 03:00:00 AM UTC",
    "messageDateTimeUTC24": "201709030300",
    "messageType": "ROUTINE ADVISORY",
    "systemDirectionOfMotion": "W OR 260 DEGREES",
    "systemGeoRefPt1": "ABOUT 1030 MI...1655 KM E OF THE LEEWARD ISLANDS",
    "systemIntensityKph": "175",
    "systemIntensityKts": "95",
    "systemIntensityMph": "110",
    "systemMslpInHg": "28.74",
    "systemMslpMb": "973",
    "systemName": "IRMA",
    "systemSaffirSimpsonCategory": "CATEGORY 2",
    "systemSpeedKph": "22",
    "systemSpeedKts": "12",
    "systemSpeedMph": "14",
    "systemType": "HURRICANE",
    "timeEpochSeconds": "1504407600"
  }
}
