{
  "cycloneMessage": {
    "advisoryNumber": "3",
    "atcfID": "AL122017",
    "centerLocLatitude": "12.3",
    "centerLocLatitudeExpanded": "12.3N",
    "centerLocLongitude": "-41.7",
    "centerLocLongitudeExpanded": "41.7W",
    "formationChancePct48h": "N/A",
    "formationChancePct5d": "N/A",
    "issuingUnit": "NWS NATIONAL HURRICANE CENTER MIAMI FL",
    "message": "ZCZC MIATCPAT2 ALL\nTTAA00 KNHC DDHHMM\n\nBULLETIN\nTropical Storm Jose Advisory Number   3\nNWS National Hurricane Center Miami FL       AL122017\n1100 PM AST Tue Sep 05 2017\n\n...JOSE CONTINUES TO GRADUALLY STRENGTHEN...\n...EXPECTED TO BECOME A HURRICANE BY WEDNESDAY NIGHT...\n\n\nSUMMARY OF 1100 PM AST...0300 UTC...INFORMATION\n-----------------------------------------------\nLOCATION...12.3N 41.7W\nABOUT 1330 MI...2140 KM E OF THE LESSER ANTILLES\nMAXIMUM SUSTAINED WINDS...50 MPH...85 KM/H\nPRESENT MOVEMENT...W OR 270 DEGREES AT 14 MPH...22 KM/H\nMINIMUM CENTRAL PRESSURE...1004 MB...29.65 INCHES\n\n\nWATCHES AND WARNINGS\n--------------------\nThere are no coastal watches or warnings in effect.\n\nInterests in the Leeward Islands should monitor the future progress\nof Jose.\n\n\nDISCUSSION AND 48-HOUR OUTLOOK\n------------------------------\nAt 1100 PM AST (0300 UTC), the center of Tropical Storm Jose was\nlocated near latitude 12.3 North, longitude 41.7 West.  Jose is\nmoving toward the west near 14 mph (22 km/h).  A slightly faster\nwest to west-northwest motion is expected during the next two days.\n\nMaximum sustained winds have increased to near 50 mph (85 km/h) with\nhigher gusts.  Additional strengthening is forecast, and Jose is\nexpected to become a hurricane by Wednesday night.\n\nTropical-storm-force winds extend outward up to 60 miles (95 km)\nfrom the center.\n\nThe estimated minimum central pressure is 1004 mb (29.65 inches).\n\n\nHAZARDS AFFECTING LAND\n----------------------\nNone.\n\n\nNEXT ADVISORY\n-------------\nNext complete advisory at 500 AM AST.\n\n$$\nForecaster Cangialosi\n\nNNNN",
    "messageBinNumber": "2",
    "messageDateTimeLocal": "20170905 11:00:00 PM AST",
    "messageDateTimeLocalStr": "1100 PM AST Tue Sep 05",
    "messageDateTimeUTC": "20170906 03:00:00 AM UTC",
    "messageDateTimeUTC24": "201709060300",
    "messageType": "ROUTINE ADVISORY",
    "systemDirectionOfMotion": "W OR 270 DEGREES",
    "systemGeoRefPt1": "ABOUT 1330 MI...2140 KM E OF THE LESSER ANTILLES",
    "systemIntensityKph": "85",
    "systemIntensityKts": "45",
    "systemIntensityMph": "50",
    "systemMslpInHg": "29.65",
    "systemMslpMb": "1004",
    "systemName": "JOSE",
    "systemSaffirSimpsonCategory": "N/A",
    "systemSpeedKph": "22",
    "systemSpeedKts": "12",
    "systemSpeedMph": "14",
    "systemType": "TROPICAL STORM",
    "timeEpochSeconds": "1504666800"
  }
}
