{
  "cycloneMessage": {
    "advisoryNumber": "11",
    "atcfID": "AL142017",
    "centerLocLatitude": "13.0",
    "centerLocLatitudeExpanded": "13.0N",
    "centerLocLongitude": "-36.7",
    "centerLocLongitudeExpanded": "36.7W",
    "formationChancePct48h": "N/A",
    "formationChancePct5d": "N/A",
    "issuingUnit": "NWS NATIONAL HURRICANE CENTER MIAMI FL",
    "message": "ZCZC MIATCPAT4 ALL\nTTAA00 KNHC DDHHMM\n\nBULLETIN\nTropical Depression Lee Advisory Number  11\nNWS National Hurricane Center Miami FL       AL142017\n1100 AM AST Sun Sep 17 2017\n\n...LEE WEAKENS TO A TROPICAL DEPRESSION...\n\n\nSUMMARY OF 1100 AM AST...1500 UTC...INFORMATION\n-----------------------------------------------\nLOCATION...13.0N 36.7W\nABOUT 875 MI...1405 KM WSW OF THE CABO VERDE ISLANDS\nMAXIMUM SUSTAINED WINDS...35 MPH...55 KM/H\nPRESENT MOVEMENT...W OR 280 DEGREES AT 8 MPH...13 KM/H\nMINIMUM CENTRAL PRESSURE...1007 MB...29.74 INCHES\n\n\nWATCHES AND WARNINGS\n--------------------\nThere are no coastal watches or warnings in effect.\n\n\nDISCUSSION AND 48-HOUR OUTLOOK\n------------------------------\nAt 1100 AM AST (1500 UTC), the center of Tropical Depression Lee was\nlocated near latitude 13.0 North, longitude 36.7 West.  Lee is\nmoving toward the west near 8 mph (13 km/h).  A westward to west-\nnorthwestward motion at a similar forward speed is expected through\nTuesday.\n\nMaximum sustained winds have decreased to near 35 mph (55 km/h)\nwith higher gusts.  Additional weakening is expected, and Lee could\nbecome a remnant low by Tuesday.\n\nThe estimated minimum central pressure is 1007 mb (29.74 inches).\n\n\nHAZARDS AFFECTING LAND\n----------------------\nNone\n\n\nNEXT ADVISORY\n-------------\nNext complete advisory at 500 PM AST.\n\n$$\nForecaster Berg\n\nNNNN",
    "messageBinNumber": "4",
    "messageDateTimeLocal": "20170917 11:00:00 AM AST",
    "messageDateTimeLocalStr": "1100 AM AST Sun Sep 17",
    "messageDateTimeUTC": "20170917 03:00:00 PM UTC",
    "messageDateTimeUTC24": "201709171500",
    "messageType": "ROUTINE ADVISORY",
    "systemDirectionOfMotion": "W OR 280 DEGREES",
    "systemGeoRefPt1": "ABOUT 875 MI...1405 KM WSW OF THE CABO VERDE ISLANDS",
    "systemIntensityKph": "55",
    "systemIntensityKts": "30",
    "systemIntensityMph": "35",
    "systemMslpInHg": "29.74",
    "systemMslpMb": "1007",
    "systemName": "LEE",
    "systemSaffirSimpsonCategory": "N/A",
    "systemSpeedKph": "13",
    "systemSpeedKts": "7",
    "systemSpeedMph": "8",
    "systemType": "TROPICAL DEPRESSION",
    "timeEpochSeconds": "1505660400"
  }
}
