{
  "cycloneMessage": {
    "advisoryNumber": "8",
    "atcfID": "AL172017",
    "centerLocLatitude": "30.7",
    "centerLocLatitudeExpanded": "30.7N",
    "centerLocLongitude": "-37.6",
    "centerLocLongitudeExpanded": "37.6W",
    "formationChancePct48h": "N/A",
    "formationChancePct5d": "N/A",
    "issuingUnit": "NWS NATIONAL HURRICANE CENTER MIAMI FL",
    "message": "ZCZC MIATCPAT2 ALL\nTTAA00 KNHC DDHHMM\n\nBULLETIN\nTropical Storm Ophelia Advisory Number   8\nNWS National Hurricane Center Miami FL       AL172017\n1100 PM AST Tue Oct 10 2017\n\n...OPHELIA MOVING SOUTHEASTWARD...\n...FORECAST TO BECOME A HURRICANE BY THURSDAY...\n\n\nSUMMARY OF 1100 PM AST...0300 UTC...INFORMATION\n-----------------------------------------------\nLOCATION...30.7N 37.6W\nABOUT 785 MI...1265 KM SW OF THE AZORES\nMAXIMUM SUSTAINED WINDS...50 MPH...85 KM/H\nPRESENT MOVEMENT...SE OR 140 DEGREES AT 6 MPH...9 KM/H\nMINIMUM CENTRAL PRESSURE...1002 MB...29.59 INCHES\n\n\nWATCHES AND WARNINGS\n--------------------\nThere are no coastal watches or warnings in effect.\n\n\nDISCUSSION AND 48-HOUR OUTLOOK\n------------------------------\nAt 1100 PM AST (0300 UTC), the center of Tropical Storm Ophelia was\nlocated near latitude 30.7 North, longitude 37.6 West. Ophelia is\nmoving toward the southeast near 6 mph (9 km/h).  A southeastward\nto east-southeastward motion with some reduction in forward speed\nis forecast over the next couple of days.\n\nMaximum sustained winds are near 50 mph (85 km/h) with higher\ngusts.  Strengthening is forecast during the next 48 hours, and\nOphelia is forecast to become a hurricane by Thursday.\n\nTropical-storm-force winds extend outward up to 60 miles (95 km)\nfrom the center.\n\nThe estimated minimum central pressure is 1002 mb (29.59 inches).\n\n\nHAZARDS AFFECTING LAND\n----------------------\nNone.\n\n\nNEXT ADVISORY\n-------------\nNext complete advisory at 500 AM AST.\n\n$$\nForecaster Brown\n\nNNNN",
    "messageBinNumber": "2",
    "messageDateTimeLocal": "20171010 11:00:00 PM AST",
    "messageDateTimeLocalStr": "1100 PM AST Tue Oct 10",
    "messageDateTimeUTC": "20171011 03:00:00 AM UTC",
    "messageDateTimeUTC24": "201710110300",
    "messageType": "ROUTINE ADVISORY",
    "systemDirectionOfMotion": "SE OR 140 DEGREES",
    "systemGeoRefPt1": "ABOUT 785 MI...1265 KM SW OF THE AZORES",
    "systemIntensityKph": "85",
    "systemIntensityKts": "45",
    "systemIntensityMph": "50",
    "systemMslpInHg": "29.59",
    "systemMslpMb": "1002",
    "systemName": "OPHELIA",
    "systemSaffirSimpsonCategory": "N/A",
    "systemSpeedKph": "9",
    "systemSpeedKts": "5",
    "systemSpeedMph": "6",
    "systemType": "TROPICAL STORM",
    "timeEpochSeconds": "1507690800"
  }
}
