{
  "cycloneMessage": {
    "advisoryNumber": "7",
    "atcfID": "AL182017",
    "centerLocLatitude": "25.0",
    "centerLocLatitudeExpanded": "25.0N",
    "centerLocLongitude": "-81",
    "centerLocLongitudeExpanded": "81.0W",
    "formationChancePct48h": "N/A",
    "formationChancePct5d": "N/A",
    "issuingUnit": "NWS NATIONAL HURRICANE CENTER MIAMI FL",
    "message": "ZCZC MIATCPAT3 ALL\nTTAA00 KNHC DDHHMM\n\nBULLETIN\nTropical Storm Philippe Advisory Number   7\nNWS National Hurricane Center Miami FL       AL182017\n500 AM EDT Sun Oct 29 2017\n\n...POORLY ORGANIZED PHILIPPE NEAR EXTREME SOUTHERN FLORIDA...\n\n\nSUMMARY OF 500 AM EDT...0900 UTC...INFORMATION\n----------------------------------------------\nLOCATION...25.0N 81.0W\nABOUT 75 MI...120 KM SW OF MIAMI FLORIDA\nABOUT 55 MI...90 KM ENE OF KEY WEST FLORIDA\nMAXIMUM SUSTAINED WINDS...45 MPH...75 KM/H\nPRESENT MOVEMENT...ENE OR 70 DEGREES AT 17 MPH...28 KM/H\nMINIMUM CENTRAL PRESSURE...1000 MB...29.53 INCHES\n\n\nWATCHES AND WARNINGS\n--------------------\nCHANGES WITH THIS ADVISORY:\n\nThe Tropical Storm Watch from Craig Key to Golden Beach Florida and\nfor the Central Bahamas is discontinued.\n\nSUMMARY OF WATCHES AND WARNINGS IN EFFECT:\n\nA Tropical Storm Warning is in effect for...\n* Cuban provinces of Isla de la Juventud, La Habana, Ciudad de la\nHabana, Matanzas, Cienfuegos, and Villa Clara\n* Northwestern Bahamas\n\nFor storm information specific to your area outside the United\nStates, please monitor products issued by your national\nmeteorological service.\n\n\nDISCUSSION AND 48-HOUR OUTLOOK\n------------------------------\nAt 500 AM EDT (0900 UTC), the center of Tropical Storm Philippe was\nestimated near latitude 25.0 North, longitude 81.0 West.  Philippe\nis moving toward the east-northeast near 17 mph (28 km/h).  A turn\ntoward the northeast is expected during the next few hours,  and\na rapid motion toward the northeast is expected through Monday.\nOn the forecast track, the center of Philippe will move across the\nsouthern tip of the Florida peninsula this morning, and then across\nthe northwestern Bahamas later today.\n\nMaximum sustained winds are near 45 mph (75 km/h) with higher gusts.\nSome strengthening is forecast during the next day or so.  However,\nPhilippe is expected to become a post-tropical cyclone by tonight,\nand to become absorbed by an extratropical low on Monday.\n\nTropical-storm-force winds extend outward up to 105 miles (165 km)\nfrom the center.\n\nThe estimated minimum central pressure is 1000 mb (29.53 inches).\n\n\nHAZARDS AFFECTING LAND\n----------------------\nRAINFALL: Philippe is expected to produce additional rain\naccumulations of 1 to 3 inches over the northern Bahamas and\neastern Cuba, and additional rain accumulations of less than 1 inch\nover south Florida.  This rainfall could cause flash flooding,\nespecially in urban areas and in the mountainous terrain of Cuba.\n\nWIND: Tropical storm conditions are expected to end in the warning\narea in Cuba this morning.  Tropical storm conditions are expected\nin portions of the warning area in the northwestern Bahamas later\nthis morning.\n\n\nNEXT ADVISORY\n-------------\nNext intermediate advisory at 800 AM EDT.\nNext complete advisory at 1100 AM EDT.\n\n$$\nForecaster Pasch\n\nNNNN",
    "messageBinNumber": "3",
    "messageDateTimeLocal": "20171029 05:00:00 AM EDT",
    "messageDateTimeLocalStr": "0500 AM EDT Sun Oct 29",
    "messageDateTimeUTC": "20171029 09:00:00 AM UTC",
    "messageDateTimeUTC24": "201710290900",
    "messageType": "ROUTINE ADVISORY",
    "systemDirectionOfMotion": "ENE OR 70 DEGREES",
    "systemGeoRefPt1": "ABOUT 75 MI...120 KM SW OF MIAMI FLORIDA",
    "systemGeoRefPt2": "ABOUT 55 MI...90 KM ENE OF KEY WEST FLORIDA",
    "systemIntensityKph": "75",
    "systemIntensityKts": "40",
    "systemIntensityMph": "45",
    "systemMslpInHg": "29.53",
    "systemMslpMb": "1000",
    "systemName": "PHILIPPE",
    "systemSaffirSimpsonCategory": "N/A",
    "systemSpeedKph": "28",
    "systemSpeedKts": "15",
    "systemSpeedMph": "17",
    "systemType": "TROPICAL STORM",
    "timeEpochSeconds": "1509267600"
  }
}
