{
  "cycloneMessage": {
    "advisoryNumber": "4",
    "atcfID": "AL192017",
    "centerLocLatitude": "30.4",
    "centerLocLatitudeExpanded": "30.4N",
    "centerLocLongitude": "-49.9",
    "centerLocLongitudeExpanded": "49.9W",
    "formationChancePct48h": "N/A",
    "formationChancePct5d": "N/A",
    "issuingUnit": "NWS NATIONAL HURRICANE CENTER MIAMI FL",
    "message": "ZCZC MIATCPAT4 ALL\nTTAA00 KNHC DDHHMM\n\nBULLETIN\nTropical Storm Rina Advisory Number   4\nNWS National Hurricane Center Miami FL       AL192017\n1100 PM AST Mon Nov 06 2017\n\n...DEPRESSION BECOMES TROPICAL STORM RINA...\n\n\nSUMMARY OF 1100 PM AST...0300 UTC...INFORMATION\n-----------------------------------------------\nLOCATION...30.4N 49.9W\nABOUT 890 MI...1430 KM E OF BERMUDA\nABOUT 1405 MI...2260 KM WSW OF THE AZORES\nMAXIMUM SUSTAINED WINDS...40 MPH...65 KM/H\nPRESENT MOVEMENT...N OR 10 DEGREES AT 7 MPH...11 KM/H\nMINIMUM CENTRAL PRESSURE...1010 MB...29.83 INCHES\n\n\nWATCHES AND WARNINGS\n--------------------\nThere are no coastal watches or warnings in effect.\n\n\nDISCUSSION AND 48-HOUR OUTLOOK\n------------------------------\nAt 1100 PM AST (0300 UTC), the center of Tropical Storm Rina was\nlocated near latitude 30.4 North, longitude 49.9 West. Rina is\nmoving toward the north near 7 mph (11 km/h), and a general\nnorthward motion with an increase in forward speed is expected to\ncontinue through Wednesday, followed by a north-northeastward\nmotion on Wednesday night.\n\nSatellite wind data indicate that maximum sustained winds have\nincreased to near 40 mph (65 km/h) with higher gusts. Some\nadditional strengthening is forecast during the next day or so.\n\nTropical-storm-force winds extend outward up to 60 miles (95 km) to\nthe east of the center.\n\nThe estimated minimum central pressure is 1010 mb (29.83 inches).\n\n\nHAZARDS AFFECTING LAND\n----------------------\nNone.\n\n\nNEXT ADVISORY\n-------------\nNext complete advisory at 500 AM AST.\n\n$$\nForecaster Brennan\n\nNNNN",
    "messageBinNumber": "4",
    "messageDateTimeLocal": "20171106 11:00:00 PM AST",
    "messageDateTimeLocalStr": "1100 PM AST Mon Nov 06",
    "messageDateTimeUTC": "20171107 03:00:00 AM UTC",
    "messageDateTimeUTC24": "201711070300",
    "messageType": "ROUTINE ADVISORY",
    "systemDirectionOfMotion": "N OR 10 DEGREES",
    "systemGeoRefPt1": "ABOUT 890 MI...1430 KM E OF BERMUDA",
    "systemGeoRefPt2": "ABOUT 1405 MI...2260 KM WSW OF THE AZORES",
    "systemIntensityKph": "65",
    "systemIntensityKts": "35",
    "systemIntensityMph": "40",
    "systemMslpInHg": "29.83",
    "systemMslpMb": "1010",
    "systemName": "RINA",
    "systemSaffirSimpsonCategory": "N/A",
    "systemSpeedKph": "11",
    "systemSpeedKts": "6",
    "systemSpeedMph": "7",
    "systemType": "TROPICAL STORM",
    "timeEpochSeconds": "1510023600"
  }
}
