{
    "cycloneMessage": {
        "atcfID": "EP012017",
        "issuingUnit": "NWS NATIONAL HURRICANE CENTER MIAMI FL",
        "messageType": "ROUTINE ADVISORY",
        "messageBinNumber": "1",
        "advisoryNumber": "8",
        "messageDateTimeLocal": "20170511 10:00:00 AM CDT",
        "messageDateTimeUTC": "20170511 03:00:00 PM UTC",
        "messageDateTimeUTC24": "201705111500",
        "messageDateTimeLocalStr": "1000 AM CDT Thu May 11",
        "timeEpochSeconds": "1494514800",
        "systemType": "POST-TROPICAL CYCLONE",
        "systemName": "ADRIAN",
        "centerLocLatitude": "11.3",
        "centerLocLongitude": "-93.8",
        "centerLocLatitudeExpanded": "11.3N",
        "centerLocLongitudeExpanded": "93.8W",
        "systemIntensityMph": "30",
        "systemIntensityKph": "45",
        "systemIntensityKts": "25",
        "systemMslpMb": "1008",
        "systemMslpInHg": "29.77",
        "systemSaffirSimpsonCategory": "N/A",
        "formationChancePct48h": "N/A",
        "formationChancePct5d": "N/A",
        "systemDirectionOfMotion": "NW OR 315 DEGREES",
        "systemSpeedMph": "7",
        "systemSpeedKph": "11",
        "systemSpeedKts": "6",
        "systemGeoRefPt1": "ABOUT 350 MI...565 KM SSE OF SALINA CRUZ MEXICO",
        "message": "ZCZC MIATCPEP1 ALL\nTTAA00 KNHC DDHHMM\n\nBULLETIN\nPost-Tropical Cyclone Adrian Advisory Number   8\nNWS National Hurricane Center Miami FL       EP012017\n1000 AM CDT Thu May 11 2017\n\n...ADRIAN HAS BECOME A REMNANT LOW...\n...THIS IS THE LAST ADVISORY...\n\n\nSUMMARY OF 1000 AM CDT...1500 UTC...INFORMATION\n-----------------------------------------------\nLOCATION...11.3N 93.8W\nABOUT 350 MI...565 KM SSE OF SALINA CRUZ MEXICO\nMAXIMUM SUSTAINED WINDS...30 MPH...45 KM/H\nPRESENT MOVEMENT...NW OR 315 DEGREES AT 7 MPH...11 KM/H\nMINIMUM CENTRAL PRESSURE...1008 MB...29.77 INCHES\n\n\nWATCHES AND WARNINGS\n--------------------\nThere are no coastal watches or warnings in effect.\n\n\nDISCUSSION AND 48-HOUR OUTLOOK\n------------------------------\nAt 1000 AM CDT (1500 UTC), the center of Post-Tropical Cyclone\nAdrian was located near latitude 11.3 North, longitude 93.8 West.\nThe post-tropical cyclone is moving toward the northwest near 7 mph\n(11 km/h) and a gradual turn toward the west-northwest is expected\nover the next 48 hours.\n\nMaximum sustained winds are near 30 mph (45 km/h) with higher gusts.\nSome weakening is forecast during the next 48 hours.\n\nThe estimated minimum central pressure is 1008 mb (29.77 inches).\n\n\nHAZARDS AFFECTING LAND\n----------------------\nNone.\n\n\nNEXT ADVISORY\n-------------\nThis is the last public advisory issued by the National Hurricane\nCenter on this system.  For additional information on the remnant\nlow please see High Seas Forecasts issued by the National Weather\nService, under AWIPS header NFDHSFEPI, WMO header FZPN02 KWBC, and\non the web at http://www.opc.ncep.noaa.gov/shtml/NFDHSFEPI.shtml.\n\n\n$$\nForecaster Pasch\n\nNNNN"
    }
}