{
    "cycloneMessage": {
        "atcfID": "EP022017",
        "issuingUnit": "NWS NATIONAL HURRICANE CENTER MIAMI FL",
        "messageType": "ROUTINE ADVISORY",
        "messageBinNumber": "2",
        "advisoryNumber": "9",
        "messageDateTimeLocal": "20170602 10:00:00 AM CDT",
        "messageDateTimeUTC": "20170602 03:00:00 PM UTC",
        "messageDateTimeUTC24": "201706021500",
        "messageDateTimeLocalStr": "1000 AM CDT Fri Jun 02",
        "timeEpochSeconds": "1496415600",
        "systemType": "POST-TROPICAL CYCLONE",
        "systemName": "BEATRIZ",
        "centerLocLatitude": "17.2",
        "centerLocLongitude": "-96.1",
        "centerLocLatitudeExpanded": "17.2N",
        "centerLocLongitudeExpanded": "96.1W",
        "systemIntensityMph": "25",
        "systemIntensityKph": "35",
        "systemIntensityKts": "20",
        "systemMslpMb": "1007",
        "systemMslpInHg": "29.74",
        "systemSaffirSimpsonCategory": "N/A",
        "formationChancePct48h": "N/A",
        "formationChancePct5d": "N/A",
        "systemDirectionOfMotion": "NNE OR 20 DEGREES",
        "systemSpeedMph": "7",
        "systemSpeedKph": "11",
        "systemSpeedKts": "6",
        "systemGeoRefPt1": "ABOUT 105 MI...170 KM NNE OF PUERTO ANGEL MEXICO",
        "message": "ZCZC MIATCPEP2 ALL\nTTAA00 KNHC DDHHMM\n\nBULLETIN\nPost-Tropical Cyclone Beatriz Advisory Number   9\nNWS National Hurricane Center Miami FL       EP022017\n1000 AM CDT Fri Jun 02 2017\n\n...BEATRIZ DEGENERATES TO A REMNANT LOW PRESSURE AREA...\n...POTENTIAL FOR LIFE-THREATENING FLASH FLOODS CONTINUES IN THE\nMEXICAN STATE OF OAXACA...\n\n\nSUMMARY OF 1000 AM CDT...1500 UTC...INFORMATION\n-----------------------------------------------\nLOCATION...17.2N 96.1W\nABOUT 105 MI...170 KM NNE OF PUERTO ANGEL MEXICO\nMAXIMUM SUSTAINED WINDS...25 MPH...35 KM/H\nPRESENT MOVEMENT...NNE OR 20 DEGREES AT 7 MPH...11 KM/H\nMINIMUM CENTRAL PRESSURE...1007 MB...29.74 INCHES\n\n\nWATCHES AND WARNINGS\n--------------------\nThere are no coastal watches or warnings in effect.\n\n\nDISCUSSION AND 48-HOUR OUTLOOK\n------------------------------\nAt 1000 AM CDT (1500 UTC), the center of Post-Tropical Cyclone\nBeatriz was located near latitude 17.2 North, longitude 96.1 West.\nThe post-tropical cyclone is moving toward the north-northeast near\n7 mph (11 km/h) and this motion is expected to continue through\ntonight. On the forecast track, the remnant low should move across\nsouthern Mexico through tonight.\n\nMaximum sustained winds are near 25 mph (35 km/h) with higher gusts.\nThe cyclone is expected to dissipate tonight over southern Mexico.\n\nThe estimated minimum central pressure is 1007 mb (29.74 inches).\n\n\nHAZARDS AFFECTING LAND\n----------------------\nRAINFALL: The remnants of Beatriz are expected to produce additional\nrainfall of 2 to 5 inches over portions of the Mexican state of\nOaxaca with isolated maximum storm total amounts of 18 inches\npossible.  While rainfall intensity will be on a decreasing trend\ntoday, the potential for life-threatening flash floods and mudslides\nwill continue.  Lighter rainfall amounts in the 1 to 3 inch range\nare possible across the southern portion of the Mexican state of\nVeracruz.\n\n\nNEXT ADVISORY\n-------------\nThis is the last public advisory issued by the National Hurricane\nCenter on this system.\n\n$$\nForecaster Beven\n\nNNNN"
    }
}