{
    "cycloneMessage": {
        "atcfID": "EP032017",
        "issuingUnit": "NWS NATIONAL HURRICANE CENTER MIAMI FL",
        "messageType": "ROUTINE ADVISORY",
        "messageBinNumber": "3",
        "advisoryNumber": "8",
        "messageDateTimeLocal": "20170613 10:00:00 AM CDT",
        "messageDateTimeUTC": "20170613 03:00:00 PM UTC",
        "messageDateTimeUTC24": "201706131500",
        "messageDateTimeLocalStr": "1000 AM CDT Tue Jun 13",
        "timeEpochSeconds": "1497366000",
        "systemType": "REMNANTS OF",
        "systemName": "CALVIN",
        "centerLocLatitude": "16.5",
        "centerLocLongitude": "-96.5",
        "centerLocLatitudeExpanded": "16.5N",
        "centerLocLongitudeExpanded": "96.5W",
        "systemIntensityMph": "30",
        "systemIntensityKph": "45",
        "systemIntensityKts": "25",
        "systemMslpMb": "1007",
        "systemMslpInHg": "29.74",
        "systemSaffirSimpsonCategory": "N/A",
        "formationChancePct48h": "N/A",
        "formationChancePct5d": "N/A",
        "systemDirectionOfMotion": "NW OR 305 DEGREES",
        "systemSpeedMph": "5",
        "systemSpeedKph": "7",
        "systemSpeedKts": "4",
        "systemGeoRefPt1": "ABOUT 55 MI...90 KM N OF PUERTO ANGEL MEXICO",
        "message": "ZCZC MIATCPEP3 ALL\nTTAA00 KNHC DDHHMM\n\nBULLETIN\nRemnants Of Calvin Advisory Number   8\nNWS National Hurricane Center Miami FL       EP032017\n1000 AM CDT Tue Jun 13 2017\n\n...CALVIN DISSIPATES BUT POTENTIAL FOR HEAVY RAINS CONTINUE...\n...THIS IS THE LAST NHC ADVISORY...\n\n\nSUMMARY OF 1000 AM CDT...1500 UTC...INFORMATION\n-----------------------------------------------\nLOCATION...16.5N 96.5W\nABOUT 55 MI...90 KM N OF PUERTO ANGEL MEXICO\nMAXIMUM SUSTAINED WINDS...30 MPH...45 KM/H\nPRESENT MOVEMENT...NW OR 305 DEGREES AT 5 MPH...7 KM/H\nMINIMUM CENTRAL PRESSURE...1007 MB...29.74 INCHES\n\n\nWATCHES AND WARNINGS\n--------------------\nThere are no coastal watches or warnings in effect.\n\n\nDISCUSSION AND 48-HOUR OUTLOOK\n------------------------------\nAt 1000 AM CDT (1500 UTC), the remnants of Calvin were located near\nlatitude 16.5 North, longitude 96.5 West. The remnants are moving\ntoward the northwest near 5 mph (7 km/h) and this motion is expected\nto continue today.\n\nMaximum sustained winds are near 30 mph (45 km/h) with higher gusts.\n\nThe estimated minimum central pressure is 1007 mb (29.74 inches).\n\n\nHAZARDS AFFECTING LAND\n----------------------\nRAINFALL: Calvin is expected to produce total rain accumulations\nof 6 to 12 inches across the Mexican states of Chiapas, Oaxaca,\nGuerrero, and Veracruz, with possible isolated maximum amounts\nof 20 inches. Calvin is also forecast to produce total rain\naccumulations of 3 to 6 inches in the Mexican states of Tabasco,\nMorelos, Mexico, and Michoaca, as well as in Guatemala. These\nrains are expected to produce life-threatening flash floods\nand mudslides.\n\n\nNEXT ADVISORY\n-------------\nThis is the last public advisory issued by the National Hurricane\nCenter on Calvin.\n\n$$\nForecaster Cangialosi\n\nNNNN"
    }
}