{
  "cycloneMessage": {
    "advisoryNumber": "12",
    "atcfID": "EP042017",
    "centerLocLatitude": "19.6",
    "centerLocLatitudeExpanded": "19.6N",
    "centerLocLongitude": "-111.4",
    "centerLocLongitudeExpanded": "111.4W",
    "formationChancePct48h": "N/A",
    "formationChancePct5d": "N/A",
    "issuingUnit": "NWS NATIONAL HURRICANE CENTER MIAMI FL",
    "message": "ZCZC MIATCPEP4 ALL\nTTAA00 KNHC DDHHMM\n\nBULLETIN\nTropical Storm Dora Advisory Number  12\nNWS National Hurricane Center Miami FL       EP042017\n300 PM MDT Tue Jun 27 2017\n\n...DORA WEAKENS TO A TROPICAL STORM AS IT PASSES NORTH OF SOCORRO\nISLAND...\n\n\nSUMMARY OF 300 PM MDT...2100 UTC...INFORMATION\n----------------------------------------------\nLOCATION...19.6N 111.4W\nABOUT 65 MI...105 KM NNW OF SOCORRO ISLAND\nABOUT 245 MI...400 KM SSW OF THE SOUTHERN TIP OF BAJA CALIFORNIA\nMAXIMUM SUSTAINED WINDS...65 MPH...100 KM/H\nPRESENT MOVEMENT...WNW OR 290 DEGREES AT 13 MPH...20 KM/H\nMINIMUM CENTRAL PRESSURE...995 MB...29.39 INCHES\n\n\nWATCHES AND WARNINGS\n--------------------\nThere are no coastal watches or warnings in effect.\n\n\nDISCUSSION AND 48-HOUR OUTLOOK\n------------------------------\nAt 300 PM MDT (2100 UTC), the center of Tropical Storm Dora was\nlocated near latitude 19.6 North, longitude 111.4 West. Dora is\nmoving toward the west-northwest near 13 mph (20 km/h) and this\ngeneral motion is expected to continue through Wednesday night,\nwith a turn toward the west expected Thursday or Thursday night.\n\nMaximum sustained winds have decreased to near 65 mph (100 km/h)\nwith higher gusts.  Rapid weakening is forecast during the next\n36 to 48 hours, and Dora is expected to become a remnant low\nWednesday night or Thursday.\n\nTropical-storm-force winds extend outward up to 45 miles (75 km)\nfrom the center.  During the past several hours, the Mexican\nautomated station on Socorro Island has reported wind gusts of\n40 mph (65 km/h).\n\nThe estimated minimum central pressure is 995 mb (29.39 inches).\n\n\nHAZARDS AFFECTING LAND\n----------------------\nSURF:  Swells generated by Dora will continue to affect portions\nof the coast of southwest Mexico through Wednesday, and also affect\nportions of the coast of the southern Baja California peninsula\nover the next couple of days. These swells are likely to cause\nlife-threatening surf and rip current conditions. Please consult\nproducts from your local weather office.\n\n\nNEXT ADVISORY\n-------------\nNext complete advisory at 900 PM MDT.\n\n$$\nForecaster Beven\n\nNNNN",
    "messageBinNumber": "4",
    "messageDateTimeLocal": "20170627 03:00:00 PM MDT",
    "messageDateTimeLocalStr": "0300 PM MDT Tue Jun 27",
    "messageDateTimeUTC": "20170627 09:00:00 PM UTC",
    "messageDateTimeUTC24": "201706272100",
    "messageType": "ROUTINE ADVISORY",
    "systemDirectionOfMotion": "WNW OR 290 DEGREES",
    "systemGeoRefPt1": "ABOUT 65 MI...105 KM NNW OF SOCORRO ISLAND",
    "systemGeoRefPt2": "ABOUT 245 MI...400 KM SSW OF THE SOUTHERN TIP OF BAJA CALIFORNIA",
    "systemIntensityKph": "100",
    "systemIntensityKts": "55",
    "systemIntensityMph": "65",
    "systemMslpInHg": "29.39",
    "systemMslpMb": "995",
    "systemName": "DORA",
    "systemSaffirSimpsonCategory": "N/A",
    "systemSpeedKph": "20",
    "systemSpeedKts": "11",
    "systemSpeedMph": "13",
    "systemType": "TROPICAL STORM",
    "timeEpochSeconds": "1498597200"
  }
}
