{
  "cycloneMessage": {
    "advisoryNumber": "16",
    "atcfID": "EP062017",
    "centerLocLatitude": "11.4",
    "centerLocLatitudeExpanded": "11.4N",
    "centerLocLongitude": "-124",
    "centerLocLongitudeExpanded": "124.0W",
    "formationChancePct48h": "N/A",
    "formationChancePct5d": "N/A",
    "issuingUnit": "NWS NATIONAL HURRICANE CENTER MIAMI FL",
    "message": "ZCZC MIATCPEP1 ALL\nTTAA00 KNHC DDHHMM\n\nBULLETIN\nHurricane Fernanda Advisory Number  16\nNWS National Hurricane Center Miami FL       EP062017\n200 PM PDT Sat Jul 15 2017\n\n...FERNANDA WEAKENS A LITTLE MORE BUT COULD RESTRENGTHEN TONIGHT\nOR ON SUNDAY...\n\n\nSUMMARY OF 200 PM PDT...2100 UTC...INFORMATION\n----------------------------------------------\nLOCATION...11.4N 124.0W\nABOUT 1220 MI...1965 KM SW OF THE SOUTHERN TIP OF BAJA CALIFORNIA\nMAXIMUM SUSTAINED WINDS...130 MPH...215 KM/H\nPRESENT MOVEMENT...W OR 280 DEGREES AT 13 MPH...20 KM/H\nMINIMUM CENTRAL PRESSURE...955 MB...28.20 INCHES\n\n\nWATCHES AND WARNINGS\n--------------------\nThere are no coastal watches or warnings in effect.\n\n\nDISCUSSION AND 48-HOUR OUTLOOK\n------------------------------\nAt 200 PM PDT (2100 UTC), the center of Hurricane Fernanda was\nlocated near latitude 11.4 North, longitude 124.0 West. Fernanda is\nmoving toward the west near 13 mph (20 km/h).  A turn toward the\nwest-northwest is expected tonight, and that motion should continue\ninto early next week.\n\nMaximum sustained winds are near 130 mph (215 km/h) with higher\ngusts.  Fernanda is a category 4 hurricane on the Saffir-Simpson\nHurricane Wind Scale.  Some fluctuations in intensity are expected\nduring the next two days, but Fernanda is forecast to remain a\nmajor hurricane into early next week.\n\nHurricane-force winds extend outward up to 30 miles (45 km) from the\ncenter and tropical-storm-force winds extend outward up to 80 miles\n(130 km).\n\nThe estimated minimum central pressure is 955 mb (28.20 inches).\n\n\nHAZARDS AFFECTING LAND\n----------------------\nNone\n\n\nNEXT ADVISORY\n-------------\nNext complete advisory at 800 PM PDT.\n\n$$\nForecaster Cangialosi\n\nNNNN",
    "messageBinNumber": "1",
    "messageDateTimeLocal": "20170715 02:00:00 PM PDT",
    "messageDateTimeLocalStr": "0200 PM PDT Sat Jul 15",
    "messageDateTimeUTC": "20170715 09:00:00 PM UTC",
    "messageDateTimeUTC24": "201707152100",
    "messageType": "ROUTINE ADVISORY",
    "systemDirectionOfMotion": "W OR 280 DEGREES",
    "systemGeoRefPt1": "ABOUT 1220 MI...1965 KM SW OF THE SOUTHERN TIP OF BAJA CALIFORNIA",
    "systemIntensityKph": "215",
    "systemIntensityKts": "115",
    "systemIntensityMph": "130",
    "systemMslpInHg": "28.20",
    "systemMslpMb": "955",
    "systemName": "FERNANDA",
    "systemSaffirSimpsonCategory": "CATEGORY 4",
    "systemSpeedKph": "20",
    "systemSpeedKts": "11",
    "systemSpeedMph": "13",
    "systemType": "HURRICANE",
    "timeEpochSeconds": "1500152400"
  }
}
