{
  "cycloneMessage": {
    "advisoryNumber": "29",
    "atcfID": "EP072017",
    "centerLocLatitude": "14.6",
    "centerLocLatitudeExpanded": "14.6N",
    "centerLocLongitude": "-133.2",
    "centerLocLongitudeExpanded": "133.2W",
    "formationChancePct48h": "N/A",
    "formationChancePct5d": "N/A",
    "issuingUnit": "NWS NATIONAL HURRICANE CENTER MIAMI FL",
    "message": "ZCZC MIATCPEP2 ALL\nTTAA00 KNHC DDHHMM\n\nBULLETIN\nTropical Storm Greg Advisory Number  29\nNWS National Hurricane Center Miami FL       EP072017\n800 AM PDT Mon Jul 24 2017\n\n...GREG EXPECTED TO WEAKEN DURING THE NEXT FEW DAYS...\n\n\nSUMMARY OF 800 AM PDT...1500 UTC...INFORMATION\n----------------------------------------------\nLOCATION...14.6N 133.2W\nABOUT 1515 MI...2440 KM E OF SOUTH POINT HAWAII\nABOUT 1625 MI...2615 KM WSW OF THE SOUTHERN TIP OF BAJA CALIFORNIA\nMAXIMUM SUSTAINED WINDS...45 MPH...75 KM/H\nPRESENT MOVEMENT...W OR 280 DEGREES AT 12 MPH...19 KM/H\nMINIMUM CENTRAL PRESSURE...1003 MB...29.62 INCHES\n\n\nWATCHES AND WARNINGS\n--------------------\nThere are no coastal watches or warnings in effect.\n\n\nDISCUSSION AND 48-HOUR OUTLOOK\n------------------------------\nAt 800 AM PDT (1500 UTC), the center of Tropical Storm Greg was\nlocated near latitude 14.6 North, longitude 133.2 West.  Greg is\nmoving toward the west near 12 mph (19 km/h).  A west-northwestward\nor northwestward motion at a slower forward speed is expected\nduring the next couple of days.\n\nMaximum sustained winds are near 45 mph (75 km/h) with higher gusts.\nWeakening is forecast during the next 48 hours, and Greg is\nexpected to become a tropical depression by early Wednesday.\n\nTropical-storm-force winds extend outward up to 80 miles (130 km)\nto the northwest of the center.\n\nThe estimated minimum central pressure is 1003 mb (29.62 inches).\n\n\nHAZARDS AFFECTING LAND\n----------------------\nNone.\n\n\nNEXT ADVISORY\n-------------\nNext complete advisory at 200 PM PDT.\n\n$$\nForecaster Berg\n\nNNNN",
    "messageBinNumber": "2",
    "messageDateTimeLocal": "20170724 08:00:00 AM PDT",
    "messageDateTimeLocalStr": "0800 AM PDT Mon Jul 24",
    "messageDateTimeUTC": "20170724 03:00:00 PM UTC",
    "messageDateTimeUTC24": "201707241500",
    "messageType": "ROUTINE ADVISORY",
    "systemDirectionOfMotion": "W OR 280 DEGREES",
    "systemGeoRefPt1": "ABOUT 1515 MI...2440 KM E OF SOUTH POINT HAWAII",
    "systemGeoRefPt2": "ABOUT 1625 MI...2615 KM WSW OF THE SOUTHERN TIP OF BAJA CALIFORNIA",
    "systemIntensityKph": "75",
    "systemIntensityKts": "40",
    "systemIntensityMph": "45",
    "systemMslpInHg": "29.62",
    "systemMslpMb": "1003",
    "systemName": "GREG",
    "systemSaffirSimpsonCategory": "N/A",
    "systemSpeedKph": "19",
    "systemSpeedKts": "10",
    "systemSpeedMph": "12",
    "systemType": "TROPICAL STORM",
    "timeEpochSeconds": "1500908400"
  }
}
