{
  "cycloneMessage": {
    "advisoryNumber": "7",
    "atcfID": "EP092017",
    "centerLocLatitude": "11.5",
    "centerLocLatitudeExpanded": "11.5N",
    "centerLocLongitude": "-100.2",
    "centerLocLongitudeExpanded": "100.2W",
    "formationChancePct48h": "N/A",
    "formationChancePct5d": "N/A",
    "issuingUnit": "NWS NATIONAL HURRICANE CENTER MIAMI FL",
    "message": "ZCZC MIATCPEP4 ALL\nTTAA00 KNHC DDHHMM\n\nBULLETIN\nTropical Storm Hilary Advisory Number   7\nNWS National Hurricane Center Miami FL       EP092017\n1000 PM CDT Sat Jul 22 2017\n\n...DEPRESSION STRENGTHENS INTO TROPICAL STORM HILARY...\n\n\nSUMMARY OF 1000 PM CDT...0300 UTC...INFORMATION\n-----------------------------------------------\nLOCATION...11.5N 100.2W\nABOUT 585 MI...940 KM SSE OF MANZANILLO MEXICO\nABOUT 375 MI...600 KM S OF ACAPULCO MEXICO\nMAXIMUM SUSTAINED WINDS...40 MPH...65 KM/H\nPRESENT MOVEMENT...WNW OR 300 DEGREES AT 14 MPH...22 KM/H\nMINIMUM CENTRAL PRESSURE...1005 MB...29.68 INCHES\n\n\nWATCHES AND WARNINGS\n--------------------\nThere are no coastal watches or warnings in effect.\n\n\nDISCUSSION AND 48-HOUR OUTLOOK\n------------------------------\nAt 1000 PM CDT (0300 UTC), the center of Tropical Storm Hilary was\nlocated near latitude 11.5 North, longitude 100.2 West. Hilary is\nmoving toward the west-northwest near 14 mph (22 km/h) and this\ngeneral motion is expected to continue with a decrease in forward\nspeed during the next 48 hours.\n\nMaximum sustained winds have increased to near 40 mph (65 km/h) with\nhigher gusts.  Additional strengthening is forecast during the next\n48 hours, and Hilary could become a hurricane on Monday.\n\nTropical-storm-force winds extend outward up to 35 miles (55 km)\nfrom the center.\n\nThe estimated minimum central pressure is 1005 mb (29.68 inches).\n\n\nHAZARDS AFFECTING LAND\n----------------------\nNone\n\n\nNEXT ADVISORY\n-------------\nNext complete advisory at 400 AM CDT.\n\n$$\nForecaster Beven\n\nNNNN",
    "messageBinNumber": "4",
    "messageDateTimeLocal": "20170722 10:00:00 PM CDT",
    "messageDateTimeLocalStr": "1000 PM CDT Sat Jul 22",
    "messageDateTimeUTC": "20170723 03:00:00 AM UTC",
    "messageDateTimeUTC24": "201707230300",
    "messageType": "ROUTINE ADVISORY",
    "systemDirectionOfMotion": "WNW OR 300 DEGREES",
    "systemGeoRefPt1": "ABOUT 585 MI...940 KM SSE OF MANZANILLO MEXICO",
    "systemGeoRefPt2": "ABOUT 375 MI...600 KM S OF ACAPULCO MEXICO",
    "systemIntensityKph": "65",
    "systemIntensityKts": "35",
    "systemIntensityMph": "40",
    "systemMslpInHg": "29.68",
    "systemMslpMb": "1005",
    "systemName": "HILARY",
    "systemSaffirSimpsonCategory": "N/A",
    "systemSpeedKph": "22",
    "systemSpeedKts": "12",
    "systemSpeedMph": "14",
    "systemType": "TROPICAL STORM",
    "timeEpochSeconds": "1500778800"
  }
}
