{
  "cycloneMessage": {
    "advisoryNumber": "11",
    "atcfID": "EP102017",
    "centerLocLatitude": "15.2",
    "centerLocLatitudeExpanded": "15.2N",
    "centerLocLongitude": "-118.2",
    "centerLocLongitudeExpanded": "118.2W",
    "formationChancePct48h": "N/A",
    "formationChancePct5d": "N/A",
    "issuingUnit": "NWS NATIONAL HURRICANE CENTER MIAMI FL",
    "message": "ZCZC MIATCPEP5 ALL\nTTAA00 KNHC DDHHMM\n\nBULLETIN\nTropical Storm Irwin Advisory Number  11\nNWS National Hurricane Center Miami FL       EP102017\n800 PM PDT Mon Jul 24 2017\n\n...IRWIN NEAR HURRICANE STRENGTH...\n\n\nSUMMARY OF 800 PM PDT...0300 UTC...INFORMATION\n----------------------------------------------\nLOCATION...15.2N 118.2W\nABOUT 760 MI...1220 KM SW OF THE SOUTHERN TIP OF BAJA CALIFORNIA\nMAXIMUM SUSTAINED WINDS...70 MPH...110 KM/H\nPRESENT MOVEMENT...WNW OR 285 DEGREES AT 3 MPH...6 KM/H\nMINIMUM CENTRAL PRESSURE...993 MB...29.33 INCHES\n\n\nWATCHES AND WARNINGS\n--------------------\nThere are no coastal watches or warnings in effect.\n\n\nDISCUSSION AND 48-HOUR OUTLOOK\n------------------------------\nAt 800 PM PDT (0300 UTC), the center of Tropical Storm Irwin was\nlocated near latitude 15.2 North, longitude 118.2 West. Irwin is\nmoving toward the west-northwest near 3 mph (6 km/h).  A slow\nwestward motion is expected through early Tuesday, followed by a\nturn toward the west-southwest Tuesday night or Wednesday.\n\nMaximum sustained winds have increased to near 70 mph (110 km/h)\nwith higher gusts.  Additional strengthening is forecast, and Irwin\nis expected to become a hurricane tonight or on Tuesday.\n\nTropical-storm-force winds extend outward up to 80 miles (130 km)\nfrom the center.\n\nThe estimated minimum central pressure is 993 mb (29.33 inches).\n\n\nHAZARDS AFFECTING LAND\n----------------------\nNone\n\n\nNEXT ADVISORY\n-------------\nNext complete advisory at 200 AM PDT.\n\n$$\nForecaster Cangialosi\n\nNNNN",
    "messageBinNumber": "5",
    "messageDateTimeLocal": "20170724 08:00:00 PM PDT",
    "messageDateTimeLocalStr": "0800 PM PDT Mon Jul 24",
    "messageDateTimeUTC": "20170725 03:00:00 AM UTC",
    "messageDateTimeUTC24": "201707250300",
    "messageType": "ROUTINE ADVISORY",
    "systemDirectionOfMotion": "WNW OR 285 DEGREES",
    "systemGeoRefPt1": "ABOUT 760 MI...1220 KM SW OF THE SOUTHERN TIP OF BAJA CALIFORNIA",
    "systemIntensityKph": "110",
    "systemIntensityKts": "60",
    "systemIntensityMph": "70",
    "systemMslpInHg": "29.33",
    "systemMslpMb": "993",
    "systemName": "IRWIN",
    "systemSaffirSimpsonCategory": "N/A",
    "systemSpeedKph": "6",
    "systemSpeedKts": "3",
    "systemSpeedMph": "3",
    "systemType": "TROPICAL STORM",
    "timeEpochSeconds": "1500951600"
  }
}
