{
  "cycloneMessage": {
    "advisoryNumber": "8",
    "atcfID": "EP132017",
    "centerLocLatitude": "16.0",
    "centerLocLatitudeExpanded": "16.0N",
    "centerLocLongitude": "-126.1",
    "centerLocLongitudeExpanded": "126.1W",
    "formationChancePct48h": "N/A",
    "formationChancePct5d": "N/A",
    "issuingUnit": "NWS NATIONAL HURRICANE CENTER MIAMI FL",
    "message": "ZCZC MIATCPEP3 ALL\nTTAA00 KNHC DDHHMM\n\nBULLETIN\nTropical Storm Kenneth Advisory Number   8\nNWS National Hurricane Center Miami FL       EP132017\n200 AM PDT Sun Aug 20 2017\n\n...KENNETH EXPECTED TO BECOME A HURRICANE TODAY...\n\n\nSUMMARY OF 200 AM PDT...0900 UTC...INFORMATION\n----------------------------------------------\nLOCATION...16.0N 126.1W\nABOUT 1155 MI...1860 KM WSW OF THE SOUTHERN TIP OF BAJA CALIFORNIA\nMAXIMUM SUSTAINED WINDS...70 MPH...110 KM/H\nPRESENT MOVEMENT...W OR 280 DEGREES AT 15 MPH...24 KM/H\nMINIMUM CENTRAL PRESSURE...996 MB...29.42 INCHES\n\n\nWATCHES AND WARNINGS\n--------------------\nThere are no coastal watches or warnings in effect.\n\n\nDISCUSSION AND 48-HOUR OUTLOOK\n------------------------------\nAt 200 AM PDT (0900 UTC), the center of Tropical Storm Kenneth was\nlocated near latitude 16.0 North, longitude 126.1 West. Kenneth is\nmoving toward the west near 15 mph (24 km/h). A slower\nwest-northwestward motion is expected today, and a turn toward\nthe northwest is forecast to occur by late Monday.\n\nMaximum sustained winds are near 70 mph (110 km/h) with higher\ngusts.  Strengthening is expected, and Kenneth is forecast to\nbecome a hurricane today.\n\nTropical-storm-force winds extend outward up to 80 miles (130 km)\nfrom the center.\n\nThe estimated minimum central pressure is 996 mb (29.42 inches).\n\n\nHAZARDS AFFECTING LAND\n----------------------\nNone\n\n\nNEXT ADVISORY\n-------------\nNext complete advisory at 800 AM PDT.\n\n$$\nForecaster Brown\n\nNNNN",
    "messageBinNumber": "3",
    "messageDateTimeLocal": "20170820 02:00:00 AM PDT",
    "messageDateTimeLocalStr": "0200 AM PDT Sun Aug 20",
    "messageDateTimeUTC": "20170820 09:00:00 AM UTC",
    "messageDateTimeUTC24": "201708200900",
    "messageType": "ROUTINE ADVISORY",
    "systemDirectionOfMotion": "W OR 280 DEGREES",
    "systemGeoRefPt1": "ABOUT 1155 MI...1860 KM WSW OF THE SOUTHERN TIP OF BAJA CALIFORNIA",
    "systemIntensityKph": "110",
    "systemIntensityKts": "60",
    "systemIntensityMph": "70",
    "systemMslpInHg": "29.42",
    "systemMslpMb": "996",
    "systemName": "KENNETH",
    "systemSaffirSimpsonCategory": "N/A",
    "systemSpeedKph": "24",
    "systemSpeedKts": "13",
    "systemSpeedMph": "15",
    "systemType": "TROPICAL STORM",
    "timeEpochSeconds": "1503219600"
  }
}
