{
  "cycloneMessage": {
    "advisoryNumber": "1",
    "atcfID": "EP142017",
    "centerLocLatitude": "17.2",
    "centerLocLatitudeExpanded": "17.2N",
    "centerLocLongitude": "-107.2",
    "centerLocLongitudeExpanded": "107.2W",
    "formationChancePct48h": "100",
    "formationChancePct5d": "100",
    "issuingUnit": "NWS NATIONAL HURRICANE CENTER MIAMI FL",
    "message": "ZCZC MIATCPEP4 ALL\nTTAA00 KNHC DDHHMM\n\nBULLETIN\nPotential Tropical Cyclone Fourteen-E Advisory Number   1\nNWS National Hurricane Center Miami FL       EP142017\n300 PM MDT Tue Aug 29 2017\n\n...HURRICANE WATCH AND TROPICAL STORM WARNING ISSUED FOR PORTIONS OF\nBAJA CALIFORNIA SUR...\n\n\nSUMMARY OF 300 PM MDT...2100 UTC...INFORMATION\n----------------------------------------------\nLOCATION...17.2N 107.2W\nABOUT 225 MI...365 KM WSW OF MANZANILLO MEXICO\nABOUT 430 MI...695 KM SSE OF THE SOUTHERN TIP OF BAJA CALIFORNIA\nMAXIMUM SUSTAINED WINDS...30 MPH...45 KM/H\nPRESENT MOVEMENT...NW OR 315 DEGREES AT 9 MPH...15 KM/H\nMINIMUM CENTRAL PRESSURE...1006 MB...29.71 INCHES\n\n\nWATCHES AND WARNINGS\n--------------------\nCHANGES WITH THIS ADVISORY:\n\nThe government of Mexico has issued a Hurricane Watch and a Tropical\nStorm Warning for the coast of Baja California Sur from Todos Santos\nto Los Barriles including Cabo San Lucas.\n\nSUMMARY OF WATCHES AND WARNINGS IN EFFECT:\n\nA Hurricane Watch is in effect for...\n* Todos Santos to Los Barriles\n\nA Tropical Storm Warning is in effect for...\n* Todos Santos to Los Barriles\n\nA Hurricane Watch means that hurricane conditions are possible\nwithin the watch area.  A watch is typically issued 48 hours\nbefore the anticipated first occurrence of tropical-storm-force\nwinds, conditions that make outside preparations difficult or\ndangerous.\n\nA Tropical Storm Warning means that tropical storm conditions are\nexpected somewhere within the warning area within 36 hours.\n\nInterests elsewhere in southwestern Mexico and Baja California Sur\nshould monitor the progress of this system.\n\nFor storm information specific to your area, please monitor products\nissued by your national meteorological service.\n\n\nDISCUSSION AND 48-HOUR OUTLOOK\n------------------------------\nAt 300 PM MDT (2100 UTC), the disturbance was centered near latitude\n17.2 North, longitude 107.2 West. The system is moving toward the\nnorthwest near 9 mph (15 km/h) and this general motion with some\ndecrease in forward speed is expected during the next couple of\ndays. On the forecast track, the center of the disturbance will\napproach the southern tip of the Baja California peninsula by late\nThursday.\n\nMaximum sustained winds are near 30 mph (45 km/h) with higher gusts.\nStrengthening is forecast during the next 48 hours and the system\ncould become a hurricane late Thursday.\n\nThe disturbance is expected to become a tropical storm by Wednesday.\n* Formation chance through 48 hours...high...near 100 percent\n* Formation chance through 5 days...high...near 100 percent\n\nThe estimated minimum central pressure is 1006 mb (29.71 inches).\n\n\nHAZARDS AFFECTING LAND\n----------------------\nWIND:  Tropical storm conditions are expected to first reach the\ncoast within the warning area by late Wednesday, making outside\npreparations difficult or dangerous.  Hurricane conditions are also\npossible within the watch area by Thursday.  Tropical-storm-force\nwind gusts are possible in rainbands along the coast of Michoacan,\nColima and Jalisco tonight and Wednesday.\n\nRAINFALL:  The system is expected to produce total rain\naccumulations of 5 to 10 inches in the Mexican states of Michoacan,\nColima, Jalisco and Nayarit, with isolated maximum totals of 20\ninches possible along the immediate coast.  This rain could cause\nlife-threatening flash floods and mudslides.\n\nSURF:  Swells generated by the disturbance are affecting portions of\nthe coast of southwestern Mexico.  These swells are likely to cause\nlife-threatening surf and rip current conditions.  Please consult\nproducts from your local weather office.\n\n\nNEXT ADVISORY\n-------------\nNext intermediate advisory at 600 PM MDT.\nNext complete advisory at 900 PM MDT.\n\n$$\nForecaster Blake\n\nNNNN",
    "messageBinNumber": "4",
    "messageDateTimeLocal": "20170829 03:00:00 PM MDT",
    "messageDateTimeLocalStr": "0300 PM MDT Tue Aug 29",
    "messageDateTimeUTC": "20170829 09:00:00 PM UTC",
    "messageDateTimeUTC24": "201708292100",
    "messageType": "ROUTINE ADVISORY",
    "systemDirectionOfMotion": "NW OR 315 DEGREES",
    "systemGeoRefPt1": "ABOUT 225 MI...365 KM WSW OF MANZANILLO MEXICO",
    "systemGeoRefPt2": "ABOUT 430 MI...695 KM SSE OF THE SOUTHERN TIP OF BAJA CALIFORNIA",
    "systemIntensityKph": "45",
    "systemIntensityKts": "25",
    "systemIntensityMph": "30",
    "systemMslpInHg": "29.71",
    "systemMslpMb": "1006",
    "systemName": "FOURTEEN",
    "systemSaffirSimpsonCategory": "N/A",
    "systemSpeedKph": "15",
    "systemSpeedKts": "8",
    "systemSpeedMph": "9",
    "systemType": "POTENTIAL TROPICAL CYCLONE",
    "timeEpochSeconds": "1504040400"
  }
}
