{
  "cycloneMessage": {
    "advisoryNumber": "25",
    "atcfID": "EP152017",
    "centerLocLatitude": "17.0",
    "centerLocLatitudeExpanded": "17.0N",
    "centerLocLongitude": "-127.3",
    "centerLocLongitudeExpanded": "127.3W",
    "formationChancePct48h": "N/A",
    "formationChancePct5d": "N/A",
    "issuingUnit": "NWS NATIONAL HURRICANE CENTER MIAMI FL",
    "message": "ZCZC MIATCPEP5 ALL\nTTAA00 KNHC DDHHMM\n\nBULLETIN\nHurricane Otis Advisory Number  25\nNWS National Hurricane Center Miami FL       EP152017\n200 PM PDT Sun Sep 17 2017\n\n...OTIS RAPIDLY STRENGTHENING...\n...NOW A CATEGORY 2 HURRICANE...\n\n\nSUMMARY OF 200 PM PDT...2100 UTC...INFORMATION\n----------------------------------------------\nLOCATION...17.0N 127.3W\nABOUT 1200 MI...1930 KM WSW OF THE SOUTHERN TIP OF BAJA CALIFORNIA\nMAXIMUM SUSTAINED WINDS...105 MPH...165 KM/H\nPRESENT MOVEMENT...N OR 360 DEGREES AT 5 MPH...7 KM/H\nMINIMUM CENTRAL PRESSURE...973 MB...28.74 INCHES\n\n\nWATCHES AND WARNINGS\n--------------------\nThere are no coastal watches or warnings in effect.\n\n\nDISCUSSION AND 48-HOUR OUTLOOK\n------------------------------\nAt 200 PM PDT (2100 UTC), the center of Hurricane Otis was located\nnear latitude 17.0 North, longitude 127.3 West. Otis is moving\ntoward the north near 5 mph (7 km/h). A slow northward or\nnorth-northwestward motion is expected during the next day or two.\n\nMaximum sustained winds have significantly increased to near 105 mph\n(165 km/h) with higher gusts.  Some additional strengthening is\npossible through tonight, but weakening should commence on Monday.\n\nOtis is a very compact system.  Hurricane-force winds extend outward\nup to 25 miles (35 km) from the center and tropical-storm-force\nwinds extend outward up to 70 miles (110 km).\n\nThe estimated minimum central pressure is 973 mb (28.74 inches).\n\n\nHAZARDS AFFECTING LAND\n----------------------\nNone.\n\n\nNEXT ADVISORY\n-------------\nNext complete advisory at 800 PM PDT.\n\n$$\nForecaster Cangialosi\n\nNNNN",
    "messageBinNumber": "5",
    "messageDateTimeLocal": "20170917 02:00:00 PM PDT",
    "messageDateTimeLocalStr": "0200 PM PDT Sun Sep 17",
    "messageDateTimeUTC": "20170917 09:00:00 PM UTC",
    "messageDateTimeUTC24": "201709172100",
    "messageType": "ROUTINE ADVISORY",
    "systemDirectionOfMotion": "N OR 360 DEGREES",
    "systemGeoRefPt1": "ABOUT 1200 MI...1930 KM WSW OF THE SOUTHERN TIP OF BAJA CALIFORNIA",
    "systemIntensityKph": "165",
    "systemIntensityKts": "90",
    "systemIntensityMph": "105",
    "systemMslpInHg": "28.74",
    "systemMslpMb": "973",
    "systemName": "OTIS",
    "systemSaffirSimpsonCategory": "CATEGORY 2",
    "systemSpeedKph": "7",
    "systemSpeedKts": "4",
    "systemSpeedMph": "5",
    "systemType": "HURRICANE",
    "timeEpochSeconds": "1505682000"
  }
}
