{
  "cycloneMessage": {
    "advisoryNumber": "1A",
    "atcfID": "EP162017",
    "centerLocLatitude": "16.1",
    "centerLocLatitudeExpanded": "16.1N",
    "centerLocLongitude": "-101.6",
    "centerLocLongitudeExpanded": "101.6W",
    "formationChancePct48h": "N/A",
    "formationChancePct5d": "N/A",
    "issuingUnit": "NWS NATIONAL HURRICANE CENTER MIAMI FL",
    "message": "ZCZC MIATCPEP1 ALL\nTTAA00 KNHC DDHHMM\n\nBULLETIN\nTropical Depression Sixteen-E Intermediate Advisory Number 1A\nNWS National Hurricane Center Miami FL       EP162017\n100 PM CDT Wed Sep 13 2017\n\n...TROPICAL DEPRESSION BECOMING BETTER ORGANIZED...\n...VERY HEAVY RAINS ALREADY ON THE COAST OF MEXICO...\n\n\nSUMMARY OF 100 PM CDT...1800 UTC...INFORMATION\n----------------------------------------------\nLOCATION...16.1N 101.6W\nABOUT 120 MI...195 KM WSW OF ACAPULCO MEXICO\nABOUT 105 MI...165 KM S OF ZIHUATANEJO MEXICO\nMAXIMUM SUSTAINED WINDS...35 MPH...55 KM/H\nPRESENT MOVEMENT...NNE OR 25 DEGREES AT 5 MPH...7 KM/H\nMINIMUM CENTRAL PRESSURE...1006 MB...29.71 INCHES\n\n\nWATCHES AND WARNINGS\n--------------------\nCHANGES WITH THIS ADVISORY:\n\nNone.\n\nSUMMARY OF WATCHES AND WARNINGS IN EFFECT:\n\nA Tropical Storm Watch is in effect for...\n* Zihuatanejo to Punta Maldonado\n\nA Tropical Storm Watch means that tropical storm conditions are\npossible within the watch area, in this case within the next 12\nhours.\n\nFor storm information specific to your area, please monitor products\nissued by your national meteorological service.\n\n\nDISCUSSION AND 48-HOUR OUTLOOK\n------------------------------\nAt 100 PM CDT (1800 UTC), the center of Tropical Depression\nSixteen-E was located near latitude 16.1 North, longitude\n101.6 West.  The depression has been moving little for the past\ncouple of hours, but is expected to resume a north-northeast\ntrack near 5 mph (7 km/h) later today.  This motion will bring\nthe center of the depression near the coast of Mexico tonight\nand then inland on Thursday.\n\nMaximum sustained winds are near 35 mph (55 km/h) with higher\ngusts.  No significant change in strength is anticipated before the\ndepression moves inland.\n\nThe estimated minimum central pressure is 1006 mb (29.71 inches).\n\n\nHAZARDS AFFECTING LAND\n----------------------\n\nRAINFALL: The depression is expected to produce total rainfall\naccumulations of 5 to 10 inches with maximum totals of 15 inches\nacross southern portions of the Mexican states of Guerrero and\nMichoacan.  These rainfall amounts may produce life-threatening\nflash floods and mudslides.\n\nWIND:  Tropical storm conditions are possible within the watch\narea later today.\n\nNEXT ADVISORY\n-------------\nNext complete advisory at 400 PM CDT.\n\n$$\nForecaster Avila\n\nNNNN",
    "messageBinNumber": "1",
    "messageDateTimeLocal": "20170913 01:00:00 PM CDT",
    "messageDateTimeLocalStr": "0100 PM CDT Wed Sep 13",
    "messageDateTimeUTC": "20170913 06:00:00 PM UTC",
    "messageDateTimeUTC24": "201709131800",
    "messageType": "INTERMEDIATE ADVISORY",
    "systemDirectionOfMotion": "NNE OR 25 DEGREES",
    "systemGeoRefPt1": "ABOUT 120 MI...195 KM WSW OF ACAPULCO MEXICO",
    "systemGeoRefPt2": "ABOUT 105 MI...165 KM S OF ZIHUATANEJO MEXICO",
    "systemIntensityKph": "55",
    "systemIntensityKts": "30",
    "systemIntensityMph": "35",
    "systemMslpInHg": "29.71",
    "systemMslpMb": "1006",
    "systemName": "SIXTEEN-E",
    "systemSaffirSimpsonCategory": "N/A",
    "systemSpeedKph": "7",
    "systemSpeedKts": "4",
    "systemSpeedMph": "5",
    "systemType": "TROPICAL DEPRESSION",
    "timeEpochSeconds": "1505325600"
  }
}
