{
  "cycloneMessage": {
    "advisoryNumber": "10A",
    "atcfID": "EP172017",
    "centerLocLatitude": "19.9",
    "centerLocLatitudeExpanded": "19.9N",
    "centerLocLongitude": "-110.2",
    "centerLocLongitudeExpanded": "110.2W",
    "formationChancePct48h": "N/A",
    "formationChancePct5d": "N/A",
    "issuingUnit": "NWS NATIONAL HURRICANE CENTER MIAMI FL",
    "message": "ZCZC MIATCPEP2 ALL\nTTAA00 KNHC DDHHMM\n\nBULLETIN\nTropical Storm Norma Intermediate Advisory Number 10A\nNWS National Hurricane Center Miami FL       EP172017\n600 PM MDT Sat Sep 16 2017\n\n...SLOW MOVING NORMA CONTINUES TO INCH CLOSER TO BAJA CALIFORNIA...\n\n\nSUMMARY OF 600 PM MDT...0000 UTC...INFORMATION\n----------------------------------------------\nLOCATION...19.9N 110.2W\nABOUT 90 MI...150 KM NE OF SOCORRO ISLAND\nABOUT 210 MI...335 KM S OF CABO SAN LUCAS MEXICO\nMAXIMUM SUSTAINED WINDS...65 MPH...100 KM/H\nPRESENT MOVEMENT...N OR 360 DEGREES AT 3 MPH...6 KM/H\nMINIMUM CENTRAL PRESSURE...989 MB...29.21 INCHES\n\n\nWATCHES AND WARNINGS\n--------------------\nCHANGES WITH THIS ADVISORY:\n\nNone.\n\nSUMMARY OF WATCHES AND WARNINGS IN EFFECT:\n\nA Tropical Storm Warning is in effect for...\n* Los Barriles to Todos Santos\n\nA Tropical Storm Watch is in effect for...\n* North of Todos Santos to Cabo San Lazaro\n\nA Tropical Storm Warning means that tropical storm conditions are\nexpected somewhere within the warning area within 36 hours.\n\nA Tropical Storm Watch means that tropical storm conditions are\npossible within the watch area, generally within 48 hours.\n\nInterests in the remainder of the Baja California Peninsula should\nmonitor the progress of Norma.\n\nFor storm information specific to your area, please monitor\nproducts issued by your national meteorological service.\n\n\nDISCUSSION AND 48-HOUR OUTLOOK\n------------------------------\nAt 600 PM MDT (0000 UTC), the center of Tropical Storm Norma was\nlocated near latitude 19.9 North, longitude 110.2 West. Norma is\nmoving toward the north near 3 mph (6 km/h). The tropical storm\nis expected to move toward the north-northwest or northwest\nduring the next couple days at a slightly faster forward speed. On\nthe forecast track, the center of Norma will move near or to the\nwest of the southern Baja California Peninsula on Sunday and Monday.\n\nMaximum sustained winds are near 65 mph (100 km/h) with higher\ngusts. Weakening is forecast during the next 48 hours.\n\nTropical-storm-force winds extend outward up to 90 miles (150 km)\nfrom the center. The Mexican Navy station in Isla Socorro recently\nreported a wind gust of 48 mph (78 km/h).\n\nThe estimated minimum central pressure is 989 mb (29.21 inches).\n\n\nHAZARDS AFFECTING LAND\n----------------------\nRAINFALL:  Norma is expected to produce total rainfall accumulations\nof 2 to 4 inches over the southern portion of the Mexican state of\nBaja California Sur, with isolated maximum amounts up to 8 inches.\nThese rainfall amounts may produce life-threatening flash floods.\n\nWIND:  Tropical storm conditions are expected to first reach the\ncoast within the warning area by Sunday morning. Tropical storm\nconditions are possible within the watch area by late Sunday or\nearly Monday.\n\nSURF:  Swells generated by Norma are affecting portions of the coast\nof southwestern Mexico and Baja California Sur and will continue\ninto early next week. These swells are likely to cause life-\nthreatening surf and rip current conditions.  Please consult\nproducts from your local weather office.\n\n\nNEXT ADVISORY\n-------------\nNext complete advisory at 900 PM MDT.\n\n$$\nForecaster Brown\n\nNNNN",
    "messageBinNumber": "2",
    "messageDateTimeLocal": "20170916 06:00:00 PM MDT",
    "messageDateTimeLocalStr": "0600 PM MDT Sat Sep 16",
    "messageDateTimeUTC": "20170917 12:00:00 AM UTC",
    "messageDateTimeUTC24": "201709170000",
    "messageType": "INTERMEDIATE ADVISORY",
    "systemDirectionOfMotion": "N OR 360 DEGREES",
    "systemGeoRefPt1": "ABOUT 90 MI...150 KM NE OF SOCORRO ISLAND",
    "systemGeoRefPt2": "ABOUT 210 MI...335 KM S OF CABO SAN LUCAS MEXICO",
    "systemIntensityKph": "100",
    "systemIntensityKts": "55",
    "systemIntensityMph": "65",
    "systemMslpInHg": "29.21",
    "systemMslpMb": "989",
    "systemName": "NORMA",
    "systemSaffirSimpsonCategory": "N/A",
    "systemSpeedKph": "6",
    "systemSpeedKts": "3",
    "systemSpeedMph": "3",
    "systemType": "TROPICAL STORM",
    "timeEpochSeconds": "1505606400"
  }
}
