{
  "cycloneMessage": {
    "advisoryNumber": "7A",
    "atcfID": "EP182017",
    "centerLocLatitude": "22.6",
    "centerLocLatitudeExpanded": "22.6N",
    "centerLocLongitude": "-106.9",
    "centerLocLongitudeExpanded": "106.9W",
    "formationChancePct48h": "N/A",
    "formationChancePct5d": "N/A",
    "issuingUnit": "NWS NATIONAL HURRICANE CENTER MIAMI FL",
    "message": "ZCZC MIATCPEP3 ALL\nTTAA00 KNHC DDHHMM\n\nBULLETIN\nTropical Storm Pilar Intermediate Advisory Number 7A\nNWS National Hurricane Center Miami FL       EP182017\n600 AM MDT Mon Sep 25 2017\n\n...POORLY ORGANIZED PILAR STILL PRODUCING HEAVY RAINS AND GUSTY\nWINDS NEAR THE WEST COAST OF MEXICO...\n\n\nSUMMARY OF 600 AM MDT...1200 UTC...INFORMATION\n----------------------------------------------\nLOCATION...22.6N 106.9W\nABOUT 50 MI...85 KM SW OF MAZATLAN MEXICO\nABOUT 75 MI...115 KM NNW OF LAS ISLAS MARIAS MEXICO\nMAXIMUM SUSTAINED WINDS...40 MPH...65 KM/H\nPRESENT MOVEMENT...NNW OR 340 DEGREES AT 8 MPH...13 KM/H\nMINIMUM CENTRAL PRESSURE...1004 MB...29.65 INCHES\n\n\nWATCHES AND WARNINGS\n--------------------\nCHANGES WITH THIS ADVISORY:\n\nNone.\n\nSUMMARY OF WATCHES AND WARNINGS IN EFFECT:\n\nA Tropical Storm Warning is in effect for...\n* The coast of Mexico from Cabo Corrientes northward to Bahia\nTempehuaya, including Las Islas Marias\n\nA Tropical Storm Warning means that tropical storm conditions are\nexpected somewhere within the warning area.\n\nFor storm information specific to your area, please monitor\nproducts issued by your national meteorological service.\n\n\nDISCUSSION AND 48-HOUR OUTLOOK\n------------------------------\nAt 600 AM MDT (1200 UTC), the center of Tropical Storm Pilar was\nlocated near latitude 22.6 North, longitude 106.9 West.  Pilar is\nmoving toward the north-northwest near 8 mph (13 km/h).  A slower\nnorthward or north-northwestward motion is expected during the next\nday or so.  On the forecast track, the center of Pilar is forecast\nto move along or just west of the coast of the Mexican states of\nNayarit and Sinaloa until it dissipates in a day or so.\n\nMaximum sustained winds remain near 40 mph (65 km/h) with higher\ngusts.  Gradual weakening is forecast, and Pilar is expected to\nbecome a tropical depression later today and dissipate by Tuesday.\n\nTropical-storm-force winds extend outward up to 60 miles (95 km),\nmainly to the north of the center.\n\nThe estimated minimum central pressure is 1004 mb (29.65 inches).\n\n\nHAZARDS AFFECTING LAND\n----------------------\nRAINFALL: Pilar is expected to produce total rain accumulations of\n3 to 7 inches with possible isolated maximum amounts of 10 inches\nover the western portions of the Mexican states of Nayarit, southern\nSinaloa, and southwestern Durango through Tuesday.  This rainfall\ncould cause life-threatening flash floods and mudslides.\n\nWIND: Tropical storm conditions are occurring in a portion of the\nwarning area.  These conditions will diminish later today.\n\n\nNEXT ADVISORY\n-------------\nNext complete advisory at 900 AM MDT.\n\n$$\nForecaster Stewart\n\nNNNN",
    "messageBinNumber": "3",
    "messageDateTimeLocal": "20170925 06:00:00 AM MDT",
    "messageDateTimeLocalStr": "0600 AM MDT Mon Sep 25",
    "messageDateTimeUTC": "20170925 12:00:00 PM UTC",
    "messageDateTimeUTC24": "201709251200",
    "messageType": "INTERMEDIATE ADVISORY",
    "systemDirectionOfMotion": "NNW OR 340 DEGREES",
    "systemGeoRefPt1": "ABOUT 50 MI...85 KM SW OF MAZATLAN MEXICO",
    "systemGeoRefPt2": "ABOUT 75 MI...115 KM NNW OF LAS ISLAS MARIAS MEXICO",
    "systemIntensityKph": "65",
    "systemIntensityKts": "35",
    "systemIntensityMph": "40",
    "systemMslpInHg": "29.65",
    "systemMslpMb": "1004",
    "systemName": "PILAR",
    "systemSaffirSimpsonCategory": "N/A",
    "systemSpeedKph": "13",
    "systemSpeedKts": "7",
    "systemSpeedMph": "8",
    "systemType": "TROPICAL STORM",
    "timeEpochSeconds": "1506340800"
  }
}
