{
  "cycloneMessage": {
    "advisoryNumber": "4",
    "atcfID": "EP192017",
    "centerLocLatitude": "14.8",
    "centerLocLatitudeExpanded": "14.8N",
    "centerLocLongitude": "-101.9",
    "centerLocLongitudeExpanded": "101.9W",
    "formationChancePct48h": "N/A",
    "formationChancePct5d": "N/A",
    "issuingUnit": "NWS NATIONAL HURRICANE CENTER MIAMI FL",
    "message": "ZCZC MIATCPEP4 ALL\nTTAA00 KNHC DDHHMM\n\nBULLETIN\nTropical Depression Ramon Advisory Number   4\nNWS National Hurricane Center Miami FL       EP192017\n1000 PM CDT Wed Oct 04 2017\n\n...POORLY ORGANIZED RAMON WEAKENS TO A TROPICAL DEPRESSION...\n\n\nSUMMARY OF 1000 PM CDT...0300 UTC...INFORMATION\n-----------------------------------------------\nLOCATION...14.8N 101.9W\nABOUT 195 MI...315 KM SW OF ACAPULCO MEXICO\nMAXIMUM SUSTAINED WINDS...35 MPH...55 KM/H\nPRESENT MOVEMENT...W OR 270 DEGREES AT 12 MPH...19 KM/H\nMINIMUM CENTRAL PRESSURE...1004 MB...29.65 INCHES\n\n\nWATCHES AND WARNINGS\n--------------------\n\nCHANGES WITH THIS ADVISORY:\n\nThe government of Mexico has discontinued the Tropical Storm Watch\nfrom Puerto Angel to Acapulco.\n\nSUMMARY OF WATCHES AND WARNINGS IN EFFECT:\n\nThere are no coastal watches or warnings in effect.\n\n\nDISCUSSION AND 48-HOUR OUTLOOK\n------------------------------\nAt 1000 PM CDT (0300 UTC), the center of Tropical Depression Ramon\nwas located near latitude 14.8 North, longitude 101.9 West.  The\ndepression is moving toward the west near 12 mph (19 km/h).  A\ncontinued westward motion with an increase in forward speed is\nexpected for the next day or two.  On the forecast track, Ramon will\ncontinue moving away from the southern coast of Mexico tonight and\non Thursday.\n\nMaximum sustained winds have decreased to near 35 mph (55 km/h)\nwith higher gusts.  The depression is expected to dissipate within\nthe next 24 hours.\n\nThe estimated minimum central pressure is 1004 mb (29.65 inches).\n\n\nHAZARDS AFFECTING LAND\n----------------------\nRAINFALL: Ramon is expected to produce rainfall amounts of 1 to 3\ninches with isolated maximum amounts of 5 inches over the Mexican\nstates of Oaxaca, Guerrero, and southern Michoacan through Thursday,\nwith heaviest amounts occurring near the coast.  This rainfall\ncould cause life-threatening flash floods and mudslides.\n\n\nNEXT ADVISORY\n-------------\nNext complete advisory at 400 AM CDT.\n\n$$\nForecaster Zelinsky\n\nNNNN",
    "messageBinNumber": "4",
    "messageDateTimeLocal": "20171004 10:00:00 PM CDT",
    "messageDateTimeLocalStr": "1000 PM CDT Wed Oct 04",
    "messageDateTimeUTC": "20171005 03:00:00 AM UTC",
    "messageDateTimeUTC24": "201710050300",
    "messageType": "ROUTINE ADVISORY",
    "systemDirectionOfMotion": "W OR 270 DEGREES",
    "systemGeoRefPt1": "ABOUT 195 MI...315 KM SW OF ACAPULCO MEXICO",
    "systemIntensityKph": "55",
    "systemIntensityKts": "30",
    "systemIntensityMph": "35",
    "systemMslpInHg": "29.65",
    "systemMslpMb": "1004",
    "systemName": "RAMON",
    "systemSaffirSimpsonCategory": "N/A",
    "systemSpeedKph": "19",
    "systemSpeedKts": "10",
    "systemSpeedMph": "12",
    "systemType": "TROPICAL DEPRESSION",
    "timeEpochSeconds": "1507172400"
  }
}
