{
  "cycloneMessage": {
    "advisoryNumber": "43",
    "atcfID": "EP062017",
    "centerLocLatitude": "19.1",
    "centerLocLatitudeExpanded": "19.1N",
    "centerLocLongitude": "-146.4",
    "centerLocLongitudeExpanded": "146.4W",
    "formationChancePct48h": "N/A",
    "formationChancePct5d": "N/A",
    "issuingUnit": "NWS CENTRAL PACIFIC HURRICANE CENTER HONOLULU HI",
    "message": "ZCZC HFOTCPCP1 ALL\nTTAA00 PHFO DDHHMM\n \nBULLETIN\nTropical Storm Fernanda Advisory Number  43\nNWS Central Pacific Hurricane Center Honolulu HI   EP062017\n500 AM HST Sat Jul 22 2017\n \n...FERNANDA REMAINS A MINIMAL TROPICAL STORM WELL EAST OF HAWAII...\n \n \nSUMMARY OF 500 AM HST...1500 UTC...INFORMATION\n----------------------------------------------\nLOCATION...19.1N 146.4W\nABOUT 570 MI...915 KM E OF HILO HAWAII\nABOUT 760 MI...1225 KM E OF HONOLULU HAWAII\nMAXIMUM SUSTAINED WINDS...40 MPH...65 KM/H\nPRESENT MOVEMENT...W OR 280 DEGREES AT 9 MPH...15 KM/H\nMINIMUM CENTRAL PRESSURE...1005 MB...29.68 INCHES\n \n \nWATCHES AND WARNINGS\n--------------------\nThere are no coastal watches or warnings in effect.\n \n \nDISCUSSION AND 48-HOUR OUTLOOK\n------------------------------\nAt 500 AM HST (1500 UTC), the center of Tropical Storm Fernanda was\nlocated near latitude 19.1 North, longitude 146.4 West. Fernanda is\nmoving toward the west near 9 mph (15 km/h) and this general motion\nis expected for the next couple days with an increase in forward\nspeed.\n \nMaximum sustained winds are near 40 mph (65 km/h) with higher gusts.\nSome weakening is forecast during the next 48 hours, with Fernanda\nexpected to become a remnant low tonight.\n \nTropical-storm-force winds extend outward up to 45 miles (75 km)\nfrom the center.\n \nThe estimated minimum central pressure is 1005 mb (29.68 inches).\n \n \nHAZARDS AFFECTING LAND\n----------------------\nSurf...Large swells generated by Fernanda will continue to build\nthrough the weekend along east facing shores of the main Hawaiian\nislands.  The resultant surf will be large and potentially\ndangerous. See products issued by the National Weather Service\nforecast office in Honolulu for details.\n \n \nNEXT ADVISORY\n-------------\nNext complete advisory at 1100 AM HST.\n \n$$\nForecaster Jelsema\n \nNNNN",
    "messageBinNumber": "1",
    "messageDateTimeLocal": "20170722 05:00:00 AM HST",
    "messageDateTimeLocalStr": "0500 AM HST Sat Jul 22",
    "messageDateTimeUTC": "20170722 03:00:00 PM UTC",
    "messageDateTimeUTC24": "201707221500",
    "messageType": "ROUTINE ADVISORY",
    "systemDirectionOfMotion": "W OR 280 DEGREES",
    "systemGeoRefPt1": "ABOUT 570 MI...915 KM E OF HILO HAWAII",
    "systemGeoRefPt2": "ABOUT 760 MI...1225 KM E OF HONOLULU HAWAII",
    "systemIntensityKph": "65",
    "systemIntensityKts": "35",
    "systemIntensityMph": "40",
    "systemMslpInHg": "29.68",
    "systemMslpMb": "1005",
    "systemName": "FERNANDA",
    "systemSaffirSimpsonCategory": "N/A",
    "systemSpeedKph": "15",
    "systemSpeedKts": "8",
    "systemSpeedMph": "9",
    "systemType": "TROPICAL STORM",
    "timeEpochSeconds": "1500735600"
  }
}
